,title,link,description
448,신림역 카페 : 레인드랍커피 리유저블컵 사용,https://blog.naver.com/qhqhkiss/222490217690,
449,"신림역3룸전세 2억 원룸주인세대 완전획기적가격,옥상독점사용",https://blog.naver.com/city3ssuk/222877147336,
450,신림역 맛집 존맛 소곱창 전문 신림황소곱창,https://blog.naver.com/swan1501/222962834239,
451,신림역 맛집 본화로-삼겹살 먹고 싶으면 저온숙성 고깃집 본화로,https://blog.naver.com/le_mong98/222796667031,
452,힙한 신림역 맛집,https://blog.naver.com/eunjihello/222077319299,
453,신림역 백순대 “전주익산” 원조민속순대타운 tv맛집,https://blog.naver.com/yeheepark/222990635352,
454,(신림역 아파트)신림푸르지오1단지 임장기,https://blog.naver.com/coala_12/222413215551,
455,신림역 이비인후과: 언제나열린이비인후과(신속항원검사... ,https://blog.naver.com/oldlove1232/222987766676,
456,[신림역 버거맛집] 모닝 버거는 역시 &quot;서브웨이&quot; (지하철 아님),https://blog.naver.com/jhan4251/222988537177,
457,신림역맛집  신림 닭발의 터줏대감 가야불닭발,https://blog.naver.com/mtei2828/222966732406,
458,"관악구 봉천역~신림역사이 대로변, 독특하고 세련된 인테리어로... ",https://blog.naver.com/tka3000/222935947968,
459,성민양꼬치 신림역점  |  성민양꼬치가 신림역에도 생겼따. 신림... ,https://blog.naver.com/wisdom_blog/222992220969,
460,"[내돈내산] 신림역 연어, 방어 맛집 연하남",https://blog.naver.com/pigbank116/222970718568,
461,신림역 모임 장소 추천 콜키지 무료 신림고기집 본화로,https://blog.naver.com/lavenderj-/222969762600,
462,"P2P투자) 위펀딩 - 신림역 수익형 원룸 신축(16%, 4개월)... ",https://blog.naver.com/seuya/222977903742,
463,쉑쉑버거 먹으러 갔던 신림역 타임스트림 쉐이크쉑 신림 혼밥... ,https://blog.naver.com/soato42/222824765362,
464,고기싸롱 서울 신림역,https://blog.naver.com/gilkhun/222760758270,
465,"신대방역/신림역 카페 추천 l 포장, 배달 전문 카페 땡스어라떼",https://blog.naver.com/khretail/222799898632,
466,서울 신림역 성인피아노 레슨 훈피아노에서 이루마곡 배우고... ,https://blog.naver.com/flamenebula/222809143530,
467,신대방역 신림역 신사시장 근처 비 피해상황,https://blog.naver.com/june_621/222845552597,
468,서울 신림역 [독도해물탕] 관악구 해산물 맛집 해물찜 메뉴 추천,https://blog.naver.com/wjdwlsdud321/222987698844,
469,"신림역핫도그 &quot;경성찹쌀꽈배기&quot; 핫도그, 감자고로케 추천해요~",https://blog.naver.com/ckdzms/222978671727,
470,신림역 훌랄라치킨 신메뉴 참숯치즈양념구이 치즈가득 매력있네,https://blog.naver.com/kagama007/222783860961,
471,소금빵이 맛있는 신림역 당곡역 대형 디저트 카페 던에이비씨,https://blog.naver.com/ygh1554/222986481455,
472,신림역왁싱은 12년차왁싱샵 프레쉬죠:D,https://blog.naver.com/fresh_kim/222682194147,
473,신림역 고기집 향긋한 미나리 삼겹살 잘하는 식당,https://blog.naver.com/kagama007/222713014764,
474,신림역샤브샤브 : 명동칼국수에서 건강하게 배부르게 먹은 리뷰,https://blog.naver.com/yhj88/222773823705,
475,"신림역 카페 디저트문 - Desert Moon, 샌드위치 맛집",https://blog.naver.com/dondogi2/222739518759,
476,신림역 사진맛집 포토시그니처 신림점에서 데이트하기,https://blog.naver.com/swhahan/222981068174,
477,"신림역 참치맛집 거해참치 - 참다랑어 배꼽살, 오도로의 향연... ",https://blog.naver.com/semins77/222847156645,
478,신림역 피자 _ 도우가 쫄깃한 더피자 The Pizza 신림점,https://blog.naver.com/cherrycokes2/222963995941,
479,"신림역 술집 꿈당, JMT 안주 맛집 외않가??",https://blog.naver.com/zialog/222980864042,
480,"230107 미세먼지, 물이 샌 신림역",https://blog.naver.com/rfvgyujmko/222977921800,
481,［배민맛집］훌랄라치킨 신림역점 참숯치즈양념구이... ,https://blog.naver.com/sujan1370/222804853579,
482,신림 센트레빌335 관악구 신림역 오피스텔 분양 정보,https://blog.naver.com/rangshu/222687755761,
483,고기싸롱 신림역점 다녀왔어요! 신림에 괜찮은 돼지고기... ,https://blog.naver.com/yongju320/222644362030,
484,신림역 한식 두루치기 맛집 &apos;옛날집&apos;,https://blog.naver.com/2henryblog/222364998989,
485,신림역 도우맨션 봉천동 작은 골목의 숨은 브런치 맛집,https://blog.naver.com/dailyzandang/222968194891,
486,신림역 헬스 하체운동은 빠질 수 없어요!,https://blog.naver.com/ddxqcn58/222308201029,
487,신림미용실 신림역미용실 박승철 헤어스투디오 클리닉,https://blog.naver.com/dorothy_1114/222795525040,
488,신림역 맛집 / 미남참치 스페셜코스 참치 무한리필 리뷰,https://blog.naver.com/vip1352/222990183244,
489,신림역 점심 홍콩반점 짜장면,https://blog.naver.com/huihee98/222966611890,
490,[맛집] 인생쌀국수맛집 찾음! 신림역쌀국수 &apos;포비엣&apos;,https://blog.naver.com/rkqkdthsu/222946412445,
491,신림역 술집 노래하는 감성포차 어셈블,https://blog.naver.com/ddi02084/222973090900,
492,신림역 펍 음악이 힙한 큐브더라운지,https://blog.naver.com/dmswntkfkd04/222962600885,
493,[(구)중앙선] (구) 신림역 神林驛 _ 2015년,https://blog.naver.com/shinsy0513/222980275108,
494,"[신림역] 라공방, 이게바로 입덕 부정기?",https://blog.naver.com/bingbang0_0/222989423804,
495,케익에 진심인 신림역 카페 디저트문 최고에요!,https://blog.naver.com/kagama007/222719999273,
496,신림역닭발맛집 / 신시닭발 / 매콤한 국물닭발 야식으로 GOOD,https://blog.naver.com/leeb000/222741312873,
497,신림역 루프탑이 예쁜 디자이너리 카피,https://blog.naver.com/merrishop/222493921428,
498,신림역미용실 박승철헤어스투디오에서 뿌리염색 by.케이실장님,https://blog.naver.com/asset394/222726270664,
499,신림역 치과 라미네이트란 어떤 치료인가요?,https://blog.naver.com/akastone/222712709814,
500,신림역 맛집 냉동 삼겹살 고기집 삼삼당,https://blog.naver.com/lael_v_v/222968557205,
501,신림역맛집 / 나는남자닭 신림본점 / 신림역찜닭은 여기지~,https://blog.naver.com/leeb000/222718535611,
502,[신림역쌀국수 뜨끈한 국물이 최고] - 신림쌀국수 포비엣,https://blog.naver.com/hanghang_dream/222968625797,
503,"신림역쌀국수, 관악구쌀국수집인 포비엣에서 푸짐한 한상",https://blog.naver.com/sigk00/222897926308,
504,"신림역주변3룸 구옥이지만 가성비굿,전용15평 2000/55",https://blog.naver.com/city3ssuk/222795227014,
505,신림역 밥집 한달간 4번이나 혼밥한 명희네분식 백반,https://blog.naver.com/zm_zzang/222967731487,
506,신림역 꽃집 - 두두플라워 원데이클래스!,https://blog.naver.com/bijae10/222692415104,
507,[신림역 회식장소 추천]그래 이 맛이야! 한우차돌삼합|삼합당,https://blog.naver.com/hummingshell/222966837061,
508,신림역 맛집 삼삼당 분위기 좋은 냉삼맛집,https://blog.naver.com/sasabana/222684872911,
509,신림역 오피스텔 센트라빌335 주상복합 상가분양,https://blog.naver.com/fghhtdfgh89/222688101741,
510,[신림역 삼겹살 맛집] &quot;내돈내먹&quot; 부추 삼겹살 딱이야,https://blog.naver.com/heebomi/222697817109,
511,[221207] 신림역맛집 교토 / 저렴한신림동초밥맛집,https://blog.naver.com/alrud7877/222949417098,
512,신림역 이자카야 맛집 카미사토,https://blog.naver.com/lv5photo/222690318430,
513,오하운 크레페 샌드위치 (feat. 신림역 카페 추천/크레페 맛집),https://blog.naver.com/arashi310/222765037673,
514,@ 신림역 맛집 _ 메밀국수맛집 막불감동,https://blog.naver.com/2xhong/222678223618,
515,신림역 고기집 한마음정육식당 : 돼지고기 맛집 인정해요,https://blog.naver.com/jjong_322/222980335662,
516,신림역치과 교정으로 고민하고 있다면,https://blog.naver.com/histo3330/222837398504,
517,신림 맛집 성민양꼬치 신림역점 별빛신사리 술한잔 하기좋은 곳,https://blog.naver.com/heney1981/222953902407,
518,"[신림역술집/맥주밤거리,맥밤]요즘같이 억수로 더울때 딱이었던... ",https://blog.naver.com/mjinchul1/222801001716,
519,신림역하면 무좌건~~백순대,https://blog.naver.com/gkrry2239/222958571426,
520,신림역 카페 와플이 다양하고 맛있는 놀러와플,https://blog.naver.com/dmswntkfkd04/222960936763,
521,서울 신림역 맛집 중식 아리차이,https://blog.naver.com/m600105/222699955425,
522,신림역 맛집 이모포차 순살닭도리탕 볶음밥까지,https://blog.naver.com/qkqhtlzld95/222954233989,
523,"맛집, 신림역 백순대, 신림 백순대, 신림 맛집, 신림동 맛집... ",https://blog.naver.com/00sick22/222948319042,
524,신림역 고기집 신선한 고기와 푸짐한 밑반찬 파채쫄면이 맛있는... ,https://blog.naver.com/dltlsqldid/222817839442,
525,신림역 헬스장 새로운 플랭크 알아봐요,https://blog.naver.com/ddxqcn58/222191364358,
526,신림역 점심 가츠동 모모야,https://blog.naver.com/huihee98/222961359053,
527,"핫해지기 전 선점한 곳, 신림역 경자식당 내돈내산 솔직후기",https://blog.naver.com/ourmama0a/222969895638,
528,신림사주 잘보는 곳 신림역 참좋은 역학원 운세 및 진로상담,https://blog.naver.com/wkddbsk308/222759632914,
529,신림 술집 신림역 맛집 나는 남자닭 닭도리탕 소주 당기는 맛,https://blog.naver.com/chalk0801/222962561236,
530,신림역 헬스 바이퍼로 효율적인 운동해요,https://blog.naver.com/ddxqcn58/222010632222,
531,신림역 PT 여성전용 헬스장 추천: 휘트니스피플 신림점 PT 후기,https://blog.naver.com/rami_c/222819026285,
532,관악구 신림역 / 구루메키친 -  이게 진짜 가성비지.,https://blog.naver.com/elyann/222581479013,
533,신림역 카페 신림 카페 꾸덕한 수제 디저트 맛집 @디저트문,https://blog.naver.com/asset394/222702105052,
534,"신림역 플라워 카페, BLO.M(블로엠) 향긋한 향기가 지배하는 곳",https://blog.naver.com/teawung10/222925018286,
535,신림역 타임스트림 맛집 신림역샤브샤브 맛집 명동칼국수... ,https://blog.naver.com/moony1212/222969174816,
536,신림역 미나리삼겹살 폭풍흡입,https://blog.naver.com/elacker/222738170422,
537,신림역 지리산삼계탕 신림점 들깨 녹두 삼계탕 갈비탕 맛집,https://blog.naver.com/pine0202/222738719829,
538,센트레빌335 신림역 오피스텔 분양 조건,https://blog.naver.com/1230tndus/222610379490,
539,신림역 맛집 여름필수 동치미막국수 막불감동,https://blog.naver.com/nanacook/222383277668,
540,［신림역백순대맛집］전주익산-고소고 담백한 백순대맛에... ,https://blog.naver.com/sujan1370/222744697144,
541,신림역 하체관리 라임뷰티 다녀왔어요~,https://blog.naver.com/kissyilove/222980670036,
542,신림역 카페 &apos;선물&apos; 아담하고 조용한 카페,https://blog.naver.com/jjin_vely/222976370842,
543,"［신림역 타로］ 아이콘 타로-타로, 사주 후기",https://blog.naver.com/sujan1370/222701659393,
544,"신림역미용실 고민하지 말고, 박승철 헤어스투디오로 고고!",https://blog.naver.com/bbholic84/222727459209,
545,"신림역 맛집, 신림에서 소갈비살 먹고싶을땐 &apos;은행나무 갈매기&apos;",https://blog.naver.com/zzang5788/222693500076,
546,신림역 신텐 깔끔한 텐동 한그릇~,https://blog.naver.com/chchqhqh/222649655232,
547,서울원룸싼곳 신림역월세 근처 426m 자취방구하기,https://blog.naver.com/i_mcheon/222721604772,
548,신림역 카페 : 모임하기 좋은 신림 디저트 카페 디저트문... ,https://blog.naver.com/sweet1137/222707659317,
549,분위기 갑 하노이의밤 즐기기 신림역 하노이맥주밤거리 신림점,https://blog.naver.com/qwer54041/222957434407,
550,신림역 바닐라라떼가 맛있는 카페 폼앤노말,https://blog.naver.com/dandinice/222979213878,
551,신림역 술집 우마 이자카야 가성비 ㄱㅊ,https://blog.naver.com/ganstrong/222948646405,
552,신림역 미용실 박준 뷰티랩 선우 디자이너님 클리닉 후기,https://blog.naver.com/kkkamak/222984040061,
553,신림 연습실 신림역 합주실 헤르츠 스튜디오 합주 후기,https://blog.naver.com/dorothy_1114/222807901133,
554,신림역 분식집 _튀김떡볶이[광장시장 마약김밥] 음.. 과연?... ,https://blog.naver.com/dldnfl5/222977167700,
555,신림역 회식/신림 꼬치구이 &quot;북경경무대 꼬치구이&quot; 깨끗하고... ,https://blog.naver.com/dltlsqldid/222788937788,
556,신림역 젤네일 예쁘게 잘 하는곳!,https://blog.naver.com/popmin/222677172726,
557,신림역 근처 원룸 화장실 청소,https://blog.naver.com/jj3364432/222978236083,
558,[신림맛집] 신림역 백순대 양많은 곳! 맛도 있는 곳! - 305호... ,https://blog.naver.com/misssya/222981999214,
559,신림역맛집 : 분위기 좋은 신림 술집 린생사진관신림역점에서... ,https://blog.naver.com/ohime728/222743250501,
560,[맛집] 싱싱한 참치를 즐기고 싶을때_신림역참치 &apos;최후의 참치&apos;,https://blog.naver.com/dmd7438/222983827628,
561,신림역 김기철의 장수왕만두 잡채호떡 고기호떡 먹기,https://blog.naver.com/biology_kim/222707777233,
562,신림역원룸 492m 남향방 보증금300부터,https://blog.naver.com/i_mcheon/222679642916,
563,저온숙성 특삼겹살이 맛있는 신림역 고기집 일품,https://blog.naver.com/fromjtoyou/222655199612,
564,신림역 카페방장 Fang Jang 조용하고 분위기 좋은 카페,https://blog.naver.com/berronica100/222984012582,
565,신림역 카페/ 포말커피 FOAMAL COFFEE,https://blog.naver.com/rolo_ggo/222260463071,
566,"신림역 분위기좋은 파스타 맛집 오늘은, 이태리",https://blog.naver.com/merrishop/222662679536,
567,신림역 안경점 콘택트 원데이렌즈 싼곳!,https://blog.naver.com/dbnote/222713845725,
568,신림역 점심 가츠동 카레마치,https://blog.naver.com/huihee98/222962267836,
569,중앙선 신림역이 전나무,https://blog.naver.com/keg211/222714357710,
570,신림역  또순이원조순대볶음맛집 백순대,https://blog.naver.com/noljaya2/222957958800,
571,서울 주상복합 오피스텔 관악구 신림역 헤센 더스타 분양정보,https://blog.naver.com/land9944/222830081956,
572,신림역 맛집 신림부뚜막,https://blog.naver.com/decentcouple1/222989923848,
573,신림역 공영주차장:: 신원시장 공영주차장,https://blog.naver.com/ppppearl/222951712840,
574,신림동 순대타운 맛집 《삼촌네》 신림역 백순대 맛집 강력추천!,https://blog.naver.com/annchoi758/222966827927,
575,[신림역필라테스 추천] 신림필라테스 신림 이브필라테스... ,https://blog.naver.com/eoudy/222852995659,
576,신림역 맛집 막창굽는 연탄할매 막창 닭발 분위기 좋은 예쁜... ,https://blog.naver.com/qkqhtlzld95/222972492747,
577,신림역 이자카야 신림오뎅바,https://blog.naver.com/doongddal/222691936209,
578,"신림역 카페 &lt;커피어반&gt; 모임, 커피, 디저트 전부 합격",https://blog.naver.com/noori_world/222934749519,
579,신림역 맛집 &lt;박재성의 메밀숯불닭갈비&gt; 그리고 스타벅스 신림... ,https://blog.naver.com/ctsengben/222990217159,
580,탄성터졌던 신림역 곱창,https://blog.naver.com/coffeeicream/222720932012,
581,[신림역 / 당곡역 맛집] 만이천원의 행복! 생삼겹살 맛집!... ,https://blog.naver.com/claudia911/222981743617,
582,신림역 술집/펍 다트와 포켓볼 여러가지 게임이 있는... ,https://blog.naver.com/dltlsqldid/222799010553,
583,신림역 헬스 허벅지 안쪽살 오늘부로 안녕!,https://blog.naver.com/ddxqcn58/222165443762,
584,신림역 생생조개 조개찜 먹기,https://blog.naver.com/biology_kim/222666132308,
585,"신림역3룸 전세26000,반전세2억/30 채광좋은집",https://blog.naver.com/city3ssuk/222653892440,
586,현지인이 추천하는 신림역 근처 주차장 꿀팁,https://blog.naver.com/inzera/222972523941,
587,"신림역 백반집/전주식당(내장탕, 닭곰탕), 푸짐한식당(우렁쌈밥... ",https://blog.naver.com/28ssan/222858980941,
588,혼수예단전문점 / 이브자리코디센 슬립앤슬립 관악신림역점... ,https://blog.naver.com/lovesongbaby/222965624697,
589,신림역 점심 명동칼국수샤브샤브,https://blog.naver.com/huihee98/222958667015,
590,신림역 필라테스 신림최대여성전문필라테스,https://blog.naver.com/ddxqcn58/221990763111,
591,더베리타스#신림동 전세# 3룸#2룸# 신림역1번출구 도보1분... ,https://blog.naver.com/k3084572/222904758059,
592,신림동신축빌라 신림역초역세권을 경험하다,https://blog.naver.com/wit_realtor/222661599655,
593,[신림역 샐러드] 커스텀샐러드,https://blog.naver.com/dory____v/222955951483,
594,신림역 점심 함박스테이크 코바코,https://blog.naver.com/huihee98/222957038162,
595,신림역 점심 돈까스 긴자료코,https://blog.naver.com/huihee98/222956760135,
596,신림역 푸짐한 미남대게 폭식하고 왔어요,https://blog.naver.com/merrishop/222294483866,
597,신림역 주차장 별빛신사리 주차비 할인 이벤트,https://blog.naver.com/lessismoremin/222955942667,
598,훌랄라치킨 / 훌랄라참숯치킨 신림역점 ~ 주말에 즐긴 데리야끼... ,https://blog.naver.com/r4race/222979044659,
599,신림역 닭강정 연구소 &apos;닭광정&apos; 추천,https://blog.naver.com/rlatnajd/222937838596,
600,[맛집] 신사리즉석떡볶이 :: 신림역 떡볶이 맛집 / 즉석떡볶이가... ,https://blog.naver.com/dldkal93/222978069466,
601,포도원삼계탕 #신림역,https://blog.naver.com/lucete3rose_j/222978974061,
602,신림역맛집 내돈내산 생생조개 이모포차 솔직후기,https://blog.naver.com/rua_prin2/222981086299,
603,신림역 치과 난도 높은 치료도 능숙하게,https://blog.naver.com/homs1829/222931192833,
604,감성 루프탑이 있는 신림역 술집_경자식당,https://blog.naver.com/tgv654/222959693642,
605,신림역원룸월세 지상에 역근처 오백에 32만원,https://blog.naver.com/i_mcheon/222753391072,
606,신림역 술집 ‘ 달꼬미 요리주점 ’,https://blog.naver.com/minjei92/222987962756,
607,신림역 초밥아저씨 특모듬초밥 먹기,https://blog.naver.com/biology_kim/222639927237,
608,신림역 헬스장 전신 운동으로 체지방 날리기,https://blog.naver.com/ddxqcn58/222298971490,
609,신림역 조개찜  조개특별시 내돈내산 솔직한후기,https://blog.naver.com/jjya90210/222972444148,
610,[신림역] 카페디저트문,https://blog.naver.com/minseo323232/222669781446,
611,[신림역] 베트남 현지인의 비법이 있는 신림 쌀국수 맛집 &apos;포비엣&apos;,https://blog.naver.com/hyejini0321/222967680047,
612,신림역 필라테스 더바디핏필라테스에서 라인만들기,https://blog.naver.com/ddxqcn58/221931964674,
613,신림역 헬스장 하체 운동으로 칼로리 날려버리기,https://blog.naver.com/fpeoplew1/222666956307,
614,또 가야하는 신림동 신림역 족발,https://blog.naver.com/fromantic/222543556953,
615,"[신림역 레터링 케이크 추천] 신림역 도시락, 레터링 케이크... ",https://blog.naver.com/sjy432/222967651603,
616,"[신림역 맛집] 숯불에 구워먹는 쪽갈비, 록갈비",https://blog.naver.com/sarah_16/222979500836,
617,"서울 오피스텔 - 신림역, 당곡역 더블역세권 신림 에스포레... ",https://blog.naver.com/ksi0067/222874448499,
618,신림역 디저트 카페 레인드랍커피 가성비 너무 좋은데요?,https://blog.naver.com/lessismoremin/222954475354,
619,신림역 속눈썹펌 속눈썹시술은 &apos;고넴&apos; 에서,https://blog.naver.com/kuhlemadchen/222967775564,
620,신림역 맛집 :: 신림 춘천집 본점 치즈닭갈비 100%내돈내산,https://blog.naver.com/ppppearl/222952238933,
621,"신림역 카페, 마크빈베이커리 크루와상 추천",https://blog.naver.com/jjw3493/222259143360,
622,신림역 헬스장 루프밴드로 색다른 자극 느껴요,https://blog.naver.com/ddxqcn58/222139433301,
623,신림역술집 경자식당 분위기 좋은 한식요리주점,https://blog.naver.com/zlegameyet1/222990941513,
624,신림역 횟집 어사출또 가성비 세트 추천해요,https://blog.naver.com/moony1212/222950232623,
625,신림역카페&quot;카페in하루&quot;착한 가격 분위기 좋은 카페에서... ,https://blog.naver.com/ekgus1633/222968700364,
626,신림역 점심 매운닭다리덮밥 건강안식사,https://blog.naver.com/huihee98/222957982830,
627,수제 디저트 맛집 신림역 카페 디저트문,https://blog.naver.com/2henryblog/222642562680,
628,가성비좋은 신림역맛집 성민양꼬치,https://blog.naver.com/ttl28245/222946798050,
629,맛있어서 계속 생각나는 신림역 맛집 [스시노칸도],https://blog.naver.com/ksh85245611/222964813814,
630,타임스트림(포도몰)에 가면 신림역샤브샤브칼국수맛집... ,https://blog.naver.com/serin0177/222720632123,
631,"작업하기 좋았던 신림역디저트카페, 달다어요",https://blog.naver.com/byeolily/222986275652,
632,신림역 헬스 아직 남은 더위를 이겨내자!,https://blog.naver.com/ddxqcn58/222086583660,
633,"신림역 혼밥 24시서울밥집, 백반 맛집 제육볶음과 순두부찌개",https://blog.naver.com/bb819819/222991628876,
634,신림역 맛집 박재성의 메밀숯불닭갈비 닭목살 메밀막국수 회식... ,https://blog.naver.com/qkqhtlzld95/222967978146,
635,신림역 이자카야 길회뜨다 메뉴판 영업시간 신림역횟집 신림맛집,https://blog.naver.com/mosig2/222984214779,
636,신림역 헬스장 여자도 꼭 필요한 가슴운동,https://blog.naver.com/ddxqcn58/222102827708,
637,"신림역춤연습실 지하40평 시세절반가격 1000/65,권리800",https://blog.naver.com/city3ssuk/222676518582,
638,[서울 신림 고기집] 연탄구이... 하고 왔어요 / 신림역 7번 출구,https://blog.naver.com/daka1122/222951142850,
639,신림역 피자 맛집 더피자 신림점 반반피자 훌륭해요,https://blog.naver.com/kkkamak/222982258218,
640,"신림속눈썹펌 맛집, 신림역 솔뷰티끄 속눈썹펌 후기",https://blog.naver.com/gse07033/222967452607,
641,신림역 필라테스 요기서 첫 운동하세요!,https://blog.naver.com/ddxqcn58/222212246978,
642,신림역 맛집/데이트 분위기 좋은 술집 추천 &quot;오느른&quot;,https://blog.naver.com/dltlsqldid/222721007526,
643,아침까지 영업하는 저렴한 가격의 신림 안주맛집 신림역 금별맥주,https://blog.naver.com/2sunjuu/222978147371,
644,신림역 제대로 된 파스타 맛집 &quot;오늘은 이태리&quot;/데이트 코스로... ,https://blog.naver.com/dltlsqldid/222763622452,
645,신림역 삼겹살 삼삼당 신림맛집,https://blog.naver.com/lakiceoyr2/222975299857,
646,신림역 맛있는 차돌박이 고기집 &apos;삼합당&apos;,https://blog.naver.com/yungjoon705/222953080186,
647,[신림역 초밥] 신림 데이트 하기 좋은 맛집 추천... ,https://blog.naver.com/heebomi/222693386525,
648,스페셜했던 신림역 맛집(w.신림동 맛집),https://blog.naver.com/hellovivi77/222786268715,
649,꼼꼼한 여드름압출관리 하면 서울대입구 봉천역 신림역... ,https://blog.naver.com/dadreamskin/222865395665,
650,갤러리카페 비찰 신림역 노트북 하기좋은 카페,https://blog.naver.com/mmjj6139/222977668677,
651,[신림역 바/펍] 칵테일이 먹고 싶을 때 큐브더라운지펍,https://blog.naver.com/hangeok/222969732376,
652,신림역 제육 쌈밥 백반 밥집 한정식 맛집 추천 배바우 식당,https://blog.naver.com/uni_ujin/222975174181,
653,신림역 헬스장 보수로 난이도 업 시키기!,https://blog.naver.com/ddxqcn58/222066629724,
654,"신림역맛집 막불감동 막국수, 칼국수(포장) 후기(+메뉴)",https://blog.naver.com/heeseung823/222857574264,
655,신림역 두피관리 맛집! 숲칼프 신림역점,https://blog.naver.com/lua_1002/222992050192,
656,신림역 맛집 막불감동에서 동치미 막국수 먹고 옴 (웨이팅 팁),https://blog.naver.com/einsone11/222747834123,
657,신림역 헬스 빠르게 칼로리 소모하자,https://blog.naver.com/ddxqcn58/222137091540,
658,신림역 루프탑 카페 &quot;디자이너리&quot; 분위기와 채광이 좋은 곳,https://blog.naver.com/dltlsqldid/222773133391,
659,"신림역 사랑이백반, 집밥이 먹고싶은 자취생에게 딱이예요",https://blog.naver.com/sooyeon1202/222643278548,
660,신림역맛집 춘천집 자극적이지 않은 양념 맛의 푸짐한 닭갈비,https://blog.naver.com/cjjeon/222738836892,
661,신림역 타임스트림 무유무유 포시즌겔러리전,https://blog.naver.com/bysg123/222951716468,
662,신림역치과 무턱교정 적절한 시기는,https://blog.naver.com/plain10205/222983798639,
663,신림역 햄버거 수제버거 맛집 육즙가득 머금은 밀리언버거,https://blog.naver.com/arsoap/222691678825,
664,신림역 참치 신선한 거해참치 신림동 참치 맛집,https://blog.naver.com/issakr/222986320753,
665,신림역참치는 이곳이 죤맛탱,https://blog.naver.com/ralpher/222947127158,
666,[신림역 고구마붕어빵 내돈내산 후기] 무조건 12개로 사야함!... ,https://blog.naver.com/dkssyd63/222969672531,
