,title,link,description
0,신림역 커플마사지 묵힌 통증 확 풀리는 곳,https://blog.naver.com/dark4074/222982855687,
1,신림역치과 체계적인 과정으로,https://blog.naver.com/histo3330/222931201764,
2,신림역 마라탕 추천! 국물이 예술인 마라입구,https://blog.naver.com/wkddbsk308/222970983323,
3,신림역 헤센더스타 오피스텔 공급 정보,https://blog.naver.com/eligirl/222739656691,
4,신림역 헤센더스타 오피스텔 공급소식,https://blog.naver.com/lg1001/222803135544,
5,원주여행 용소막 성당 폐역 신림역,https://blog.naver.com/hong273526/222862600437,
6,신림역 헤센더스타 주상복합 소개,https://blog.naver.com/sp0110/222797604930,
7,강원도 원주 가볼만한곳 용소막 성당과 폐역 신림역,https://blog.naver.com/jlovehoiks/222943092474,
8,신림역 헤센 더스타 오피스텔 분양 소식,https://blog.naver.com/namimi73/222767191686,
9,신림동 오피스텔 신림역 도보 1분 헤센더스타 주상복합 정보,https://blog.naver.com/fhsjdnffh/222956611047,
10,신림역 필라테스 비욘드바디의 소규모 그룹 레슨,https://blog.naver.com/hailyday/222925562187,
11,신림역 헤센 더스타 오피스텔 정보,https://blog.naver.com/sion6252/222758027054,
12,신림역 헤센 더스타 오피스텔 공급정보,https://blog.naver.com/noteband/222790790990,
13,대체불가였던 신림역 삼겹살,https://blog.naver.com/guri912/222979477120,
14,[리뷰] 신림역 PT 바디코드필라테스&amp;PT 신림점 체험수업 후기,https://blog.naver.com/wendyhongs/222989820620,
15,신림역횟집 어사출또 대방어회 매운탕 맛있게 먹었어요,https://blog.naver.com/yoong9103/222950286312,
16,신림역 곱창 맛집 막창굽는 연탄할매 신림점 다녀왔어요,https://blog.naver.com/kyd5209/222987348070,
17,신림역 필라테스 몸매 탈바꿈!,https://blog.naver.com/gguduck3/222903765786,
18,신림역 오피스텔 헤센 더스타 공급정보,https://blog.naver.com/physication/222739839249,
19,신림역 헤센 더스타 오피스텔 공급소식,https://blog.naver.com/kkdd1000/222782647960,
20,신림역 헤센더스타 오피스텔 공급,https://blog.naver.com/loveparadox2/222746006371,
21,신림역 필라테스 아름답고 건강하게!,https://blog.naver.com/kmj9285/222941097409,
22,신림역스크린골프 모션플레이트와 함께 신림 일이삼,https://blog.naver.com/nerollia/222950218356,
23,봉천역원룸.신림역원룸10분이내 전용7평 베란다있음... ,https://blog.naver.com/city3ssuk/222985989678,
24,신림역 헤센더스타 오피스텔 분양,https://blog.naver.com/kbc1220kk/222788268028,
25,신림역 헬스장 그룹 크로스핏 러너스하이피트니스,https://blog.naver.com/2henryblog/222949005744,
26,신림역 헬스장 등 운동 루틴에 추가하면 색다른 운동!,https://blog.naver.com/ddxqcn58/222956239556,
27,신림역피부과 노화를 막고 싶다면,https://blog.naver.com/yonseigowoon/222956632653,
28,다양한 메뉴가 있는 신림역 디저트 카페 레인드랍커피 신림본점,https://blog.naver.com/jessicadog/222961287926,
29,[신림 맛집] 훌랄라치킨 신림역점 참숯 치즈 바베큐 후기,https://blog.naver.com/yjh8252/222950519536,
30,신림역 혼밥 맛깔스러웠던 엽전식당 본점,https://blog.naver.com/angelaby/222930267274,
31,신림맛집 독보적인 치즈등갈비 잘하는 신림역함지박등갈비,https://blog.naver.com/kagama007/222975863504,
32,신림역 모임 갖기 좋은 카페 커피어반,https://blog.naver.com/bizinvest/222956023250,
33,신림헬스장 파운드짐 신림역점 / PT 김수완 트레이너,https://blog.naver.com/xpel2529/222934700481,
34,센트레빌335 신림역 오피스텔 정보안내,https://blog.naver.com/hykhyk140/222692058576,
35,"신림역쌀국수, 사이공본가",https://blog.naver.com/harang0101/222924495187,
36,[신림역 당곡역 맛집] 신림양면소 한식 퓨전 파스타 존맛 추천,https://blog.naver.com/einsone11/222988284788,
37,신림역 데이트 엽전식당에서 든든한 한 끼,https://blog.naver.com/kimhn92/222930297661,
38,바다 안가도 됨 가성비 신림역 횟집 어사출또 있으니까,https://blog.naver.com/2henryblog/222949516062,
39,신림역맛집 막국수 막불감동 만두맛집이네요,https://blog.naver.com/jjubu0691/222927336395,
40,"[관악구] 신림역전_신림역 주변 괜찮은 모듬전, 김치찌개 맛집.",https://blog.naver.com/slumkill/222962391034,
41,[신림] 신림역 맛집 신림 춘천집,https://blog.naver.com/bnr223/222926080032,
42,신림역 카페 읍천리 382에서 브런치 즐기기,https://blog.naver.com/hyein811/222979777383,
43,"신림 포차 날밤포차, 모듬회 + 가리비회 : 신림역 횟집 추천",https://blog.naver.com/poodee/222990941584,
44,신림역 샤브샤브 맛집 무한리필 뽕잎사랑 feat.런치메뉴,https://blog.naver.com/be-focus/222937291826,
45,신림역 맛집 마뇨떡볶이 마음껏 먹을 수 있는데 맛도 좋음,https://blog.naver.com/loveyou12/222968835375,
46,"신림역 파스타 르브와 신림점, 가성비 레스토랑",https://blog.naver.com/1134sin/222975406967,
47,한우곱창에 자부심을 가지고 임하는 신림역 맛집 곱창나라,https://blog.naver.com/xpel2529/222949175041,
48,230115 신림역 스시 맛집 혼맛스시,https://blog.naver.com/haha9280/222986774499,
49,신림역 비염치료 : 비염침 비염고 : 올리브한의원,https://blog.naver.com/drdiet/222989889544,
50,닭발이 맛있는 신림역 맛집 [두리닭발앤쪽갈비],https://blog.naver.com/ksh85245611/222989999106,
51,신림역카페 신림동디저트 놀러와플에서 커피와 와플~,https://blog.naver.com/estarlit/222983424577,
52,신림역 계란빵과 잉어빵,https://blog.naver.com/wowjina83/222974821722,
53,신림역 삼겹살 한돈 신림맛집 다랑이삼겹살,https://blog.naver.com/doongddal/222932092311,
54,"충만한, 볼륨을 줄이지않는 본격 LP 뮤직바 - 신림역 우드스탁",https://blog.naver.com/mercyblu/222983478108,
55,"신림역 닭꼬치, 노포감성 물씬풍기는 봉사리 생닭꼬치 직화구이",https://blog.naver.com/teawung10/222988890180,
56,"신림역옥탑방,옥상전체 독점사용,음악작업.악기모두가능,500/45",https://blog.naver.com/city3ssuk/222978337416,
57,신림놀거리 플레이인더박스 신림역점 복숭아필터 인생네컷,https://blog.naver.com/zizimi89/222939657473,
58,[신림역맛집/ 신림 곱창] 곱창구이&amp;대창구이&amp;막창구이! 막창... ,https://blog.naver.com/bluepostcards/222992028685,
59,신림역 필라테스 올해의 올바른 자세는 더바디핏과 함께!,https://blog.naver.com/kvidopkgac/222975505302,
60,신림 도넛 맛집 신림역카페 홀리앤졸리,https://blog.naver.com/2henryblog/222934830085,
61,신림역 술집 하노이맥주밤거리 맥밤 드뎌가봄,https://blog.naver.com/dalcomhi/222949567430,
62,"신림역 맛집, 신림 순대촌, 원조민속순대타운, 전라도 순창",https://blog.naver.com/hex79/222950582834,
63,교통사고후유증 치료 : 신림역 올리브한의원,https://blog.naver.com/drdiet/222981520800,
64,신림역 단독주택 월세/ 방3칸,https://blog.naver.com/kong4114/222906487713,
65,［신림역오뎅바］오뎅&amp;새우튀김 -신림새우튀김맛집 추천,https://blog.naver.com/sujan1370/222936573156,
66,[신림역 맛집] - 신림에서 냉삼겹살! &quot;신림 삼삼당&quot;,https://blog.naver.com/isgn/222966623200,
67,신림역 공유오피스 많이 찾는 이유,https://blog.naver.com/qant33/222968463227,
68,신림역 필라테스 연휴가 지났으니 함께 운동해볼까요?,https://blog.naver.com/kvidopkgac/222878635105,
69,신림역왁싱은 12월에도 여기에서~~~,https://blog.naver.com/fresh_kim/222946967981,
70,신림역 핫플 인스타 감성 신림 분위기 좋은 술집 수지상회... ,https://blog.naver.com/hwaja75/222980313783,
71,신림역 필라테스 2022년의 마무리는 건강하게 해볼까?,https://blog.naver.com/kvidopkgac/222934421916,
72,신림역 스터디카페 만큼 조용한 카페신림,https://blog.naver.com/be-focus/222970022530,
73,신림역 삼계탕 보양식 했어요,https://blog.naver.com/jjubu0691/222988906182,
74,신림역 예쁜 카페 궁전다방 정말 강추해요,https://blog.naver.com/estarlit/222961293133,
75,신림역 맛집 든든하게 먹었던 백년불고기물갈비,https://blog.naver.com/1134sin/222928362096,
76,신림역 혼밥하기 좋은 가성비 좋은 식당 건강안식사에서 수제... ,https://blog.naver.com/bluewins84/222941671173,
77,신림역 배달포장 전문 더피자 야식으로 Good,https://blog.naver.com/leeb000/222984554479,
78,신림역_관악별빛_내린천 #야간산책_관악신림역4번출구,https://blog.naver.com/jung34kr/222938528950,
79,디저트39 신림역점 / 신림 카페,https://blog.naver.com/xpel2529/222913038547,
80,신림역 스시 잘 나오는 혼맛스시,https://blog.naver.com/28ssan/222934566792,
81,"신림역 돈카츠 맛집 - 오,유미당 돈카츠 쌀국수",https://blog.naver.com/bijae10/222942969839,
82,연말 와인 모임 (신림역),https://blog.naver.com/katz79/222958658796,
83,신림역 카페 / 신림 신상 카페 &lt;블러커피&gt;,https://blog.naver.com/dldpflsdlcks/222976046290,
84,관악구 신림역 무인민원발급 장소 위치,https://blog.naver.com/woorawoo/222904719929,
85,[신림역 헬스장 추천] 러너스하이 피트니스,https://blog.naver.com/iake1120/222963299534,
86,신림역7번출구 가판대 7개소 설치,https://blog.naver.com/dnwlswodud/222922597171,
87,신림역카페추천 커피어반 말렌카 디저트 식후땡,https://blog.naver.com/sophisticated-/222921033462,
88,신림역 속눈썹이 너무 마음에 드는 느루스튜디오,https://blog.naver.com/dmswntkfkd04/222989753038,
89,신림역 차가운 얼음맥주가 땡기면 찾는 역전할머니맥주,https://blog.naver.com/28ssan/222917911938,
90,신림역 맛집 :: 함지박치즈등갈비,https://blog.naver.com/itsmoviebuff/222983961667,
91,신림역 필라테스 여름휴가 준비를 함께 해봅시당,https://blog.naver.com/kvidopkgac/222820928456,
92,신림역 필라테스 내 몸을 건강하게 지켜보기!,https://blog.naver.com/kvidopkgac/222746035415,
93,"신림역 베트남 음식 맛집, 사이공본가 신림점",https://blog.naver.com/wodbs0129/222921876995,
94,공부하기 좋은 신림역 카페 추천 어반커피 카페동네 신림,https://blog.naver.com/wkddbsk308/222991881332,
95,[신림역 맛집] 만성찬팅 - 중식포차,https://blog.naver.com/bears18/222989625341,
96,신림역 삼계탕 : 포도원삼계탕,https://blog.naver.com/green7333/222968827658,
97,분위기맛집 신림인스타감성 수지상회 신림역 술집,https://blog.naver.com/wkddbsk308/222966724863,
98,신림역 심야카페 커피어반 coffee urban,https://blog.naver.com/1134sin/222922369739,
99,[신림역 피부과/더마젠 후기]악건성피부에도 좋아요!,https://blog.naver.com/bosughom88/222940791455,
100,"신림역 국수, 속이 꽉찬 만두도 맛있는 국수회관",https://blog.naver.com/teawung10/222983328506,
101,신림역 헤센 더스타 공급 정보,https://blog.naver.com/zhdtkfkd0614/222800707103,
102,"신림역 애견동반 횟집, 길회뜨다",https://blog.naver.com/whqhrud0919/222992038217,
103,［신림역술집］수지상회 신림직영점- 착한가격 신림안주맛집... ,https://blog.naver.com/sujan1370/222935725705,
104,[신림역 맛집] 마늘오리,https://blog.naver.com/iake1120/222923123775,
105,단독 무한 동영상 송출 가능한 디지털보드 광고+신림역 광고 모음,https://blog.naver.com/assaran/222943720566,
106,신림역 속눈썹 느루스튜디오 속눈썹펌 제대로된 후기,https://blog.naver.com/vhfpqj327/222987347397,
107,"신림역꽃집, 서울대입구꽃집-프레리플라워",https://blog.naver.com/sj1229/222911914655,
108,신림역보쌈 흥부보쌈 가성비좋은 보쌈쟁반세트(중),https://blog.naver.com/sasabana/222935665584,
109,신림역 국밥 점심으로 먹기 좋은 24시 서울곰탕,https://blog.naver.com/1134sin/222930046513,
110,분위기있던 신림역 술집,https://blog.naver.com/yangha84/222786374684,
111,[신림] 신림역 백순대 - 해남  / 가성비 맛집 (원조 민속순대타운),https://blog.naver.com/kitty9739/222962532992,
112,신림역 여드름 흉터 재생 관리는  다드림피부연구소... ,https://blog.naver.com/dadreamskin/222943868749,
113,신림역전 / 꿀꿀한 날 막걸리 한 잔과 즐기는 고소한 전,https://blog.naver.com/xpel2529/222918960903,
114,"신림역주변 신축투룸 첫입주,전세25000,월세15000/50",https://blog.naver.com/city3ssuk/222918843281,
115,뒷목이 아플 수 있는 원인들 : 신림역한의원,https://blog.naver.com/drdiet/222957664331,
116,신림역 오뎅바 새우튀김맛집 오뎅 &amp; 새우튀김 이자카야,https://blog.naver.com/doongddal/222911147232,
117,[신림역맛집]정담은보쌈 굴보쌈 이조합 대찬성!!!,https://blog.naver.com/hey_baba/222933609668,
118,신림역 삼계탕 숨겨진 맛집 추운 겨울 몸보신 음식 추천 포도원... ,https://blog.naver.com/pablsk/222943555056,
119,커스텀 샐러드 신림역 샐러드 비건 메뉴는 없지만 궁금해서... ,https://blog.naver.com/yeonccot/222950291210,
120,[신림역카페] 배배꼬 신림점,https://blog.naver.com/iake1120/222989610142,
121,신림역치과 경험이 중요한,https://blog.naver.com/plain10205/222989776661,
122,혼마구로 먹으러 신림역 참치 신림동 참치 거해참치로 고고 꼬 ~~~~,https://blog.naver.com/yewori/222935631735,
123,고기와 함께 먹는 신림역 막국수 맛집 막불감동,https://blog.naver.com/soato42/222899531151,
124,리춘시장 신림역점(서울 관악),https://blog.naver.com/dude_72/222894359254,
125,신림역 헬스장 여름에는 역시 하체운동!,https://blog.naver.com/ddxqcn58/222752464168,
126,신림역 헤센더스타 모델하우스 서울 오피스텔 청약일정 &amp; 분양가!,https://blog.naver.com/boni47263/222742813836,
127,Stuck 신림역 도림천 옆 어두운 카페 스턱,https://blog.naver.com/teawung10/222974653076,
128,삼계탕이 맛있는 신림역 삼계탕 맛집 포도원삼계탕,https://blog.naver.com/soato42/222910996495,
129,신림역 두피관리 숲칼프 신림역점,https://blog.naver.com/scev/222991059066,
130,"신림 논다노래타운, 신림역 술집 핫플 헌팅술집",https://blog.naver.com/influence14956/222990840409,
131,신림역디저트 카페&lt;놀러와플&gt; 매장에서 먹으면 엄청 꿀맛!!,https://blog.naver.com/fud9050/222989932634,
132,신림역 카페 : 폼앤노말 FOAM &amp; NORMAL,https://blog.naver.com/qhqhkiss/222763286402,
133,부산오뎅바 | 신림 로컬들만 알고있다는 혼술도 가능한 신림역... ,https://blog.naver.com/mihye0310/222935902005,
134,신림동신축빌라 매매 관악구 신림역 분양,https://blog.naver.com/kairos73/222924314894,
135,신림역 헤센더스타 모델하우스 공급 정보,https://blog.naver.com/physication/222790941808,
136,［신림역샤브샤브］명동칼국수 샤브샤브- 명동샤브샤브 맛집... ,https://blog.naver.com/sujan1370/222916783546,
137,[신림역 맛집] 쉐이크쉑 신림적 - 언제나 맛있어,https://blog.naver.com/chwj0307/222985644819,
138,신림역원룸 깔끔하고 넓은원룸 전월세 모두 가능.주차무료,https://blog.naver.com/city3ssuk/222938104117,
139,신림 센트레빌335 신림역 오피스텔 정보,https://blog.naver.com/ghdgksmf0127/222616846174,
140,신림역족발 맛집 문성골족발집 푸짐해,https://blog.naver.com/sud23997/222886874203,
141,"[신림역 맛집] 라공방, 마라샹궈 후기",https://blog.naver.com/dayofjiwon/222886181117,
142,"신림역 닭도리탕, 야들야들한... 맛있는 영통 찌개지존 신림점",https://blog.naver.com/teawung10/222981398955,
143,신림역샤브샤브 포도몰에 위치한 명동칼국수 푸짐해요,https://blog.naver.com/yoong9103/222901236004,
144,신림역 안경 손연재 소프트 콘택트렌즈 렌아 1+1 싼곳!,https://blog.naver.com/dbnote/222915474905,
145,신림역 이자카야 술집 단새우에 우니에 취힌 미쿠,https://blog.naver.com/15632a/222988309624,
146,센트레빌335 신림역 오피스텔 정보,https://blog.naver.com/smk0107/222608546134,
147,신림역치과 교정치료의 과정에 대해,https://blog.naver.com/advance49637/222963391738,
148,신림역 WD호텔 디럭스 더블룸 숙박 후기,https://blog.naver.com/hang_loose/222922406006,
149,신림역 헤센더스타 오피스텔 분양정보,https://blog.naver.com/fhsjdnffh/222887615937,
150,신림역 오피스텔 헤센 더스타 정보,https://blog.naver.com/physication/222752509507,
151,신림역 김밥 맛집 _ 건강한 키토김밥 특별한 라면이 맛있는... ,https://blog.naver.com/cherrycokes2/222987885453,
152,신림역 증명사진 스튜디오 페이버리떼 후기,https://blog.naver.com/vlclskan/222927039065,
153,신림역 미용실 24시 타임헤어 : 이 샵 디지털S컬펌 잘하네?,https://blog.naver.com/jjong_322/222990571904,
154,신림역투룸월세 풀옵션투룸월세 2000/90 신축급... ,https://blog.naver.com/hinano00/222967483070,
155,신림역 맛집 드디어 가본 온달집,https://blog.naver.com/like5183/222963969995,
156,신림역 고구마붕어빵,https://blog.naver.com/oldlove1232/222986878330,
157,신림역왁싱샵 추천 라뽐므왁싱,https://blog.naver.com/jua1058/222867069088,
158,신림역 오피스텔 분양정보,https://blog.naver.com/x4488/222764795167,
159,신림역 올리브한의원 : 체기 체했을때 소화불량,https://blog.naver.com/drdiet/222919727709,
160,신림역 헤센 더스타 오피스텔 최신정보,https://blog.naver.com/panthree/222753600414,
161,신림역 상가 헤센더스타 정보,https://blog.naver.com/x4488/222737259381,
162,신림역 만화책방 벌툰_메뉴 추천,https://blog.naver.com/minel18/222984951208,
163,관악구 신림동 신림역 오피스텔 신축빌라 분양정보,https://blog.naver.com/iedamuse2200/222930311815,
164,[서울 신림동 맥주] 가성비 좋은 대한민국 1등 맥주 신림역 별빛... ,https://blog.naver.com/daka1122/222963966866,
165,신림역 술집 :: 신사리포차_낮술/포장마차 포차감성/노래신청,https://blog.naver.com/lunakim_04/222992062833,
166,신림 맛집 명동칼국수샤브샤브 혼밥하기 좋은 신림역... ,https://blog.naver.com/wkdgksk0605/222853037658,
167,신림역 횟집 어사출또에서 가을전어 먹고 옴,https://blog.naver.com/sse0226/222886408105,
168,"신림역 양꼬치 성민 양꼬치 - 메뉴, 가격, 위치",https://blog.naver.com/siwon0407/222991994759,
169,년간2000명 신림역 화농성 여드름관리잘하는곳... ,https://blog.naver.com/dadreamskin/222970805717,
170,신림역 (신림 카페) / 커피어반,https://blog.naver.com/gptjd1212/222988259065,
171,신림역 술집 길회뜨다 일품사시미 모듬고로케 데이트 추천,https://blog.naver.com/qkqhtlzld95/222988528102,
172,신림동순대맛집 신림역맛집 신림동호남집백순대,https://blog.naver.com/twinkle_lady/222887871627,
173,#신림역 닭갈비 맛집 #신림춘천집 본점 by 부리부리잭,https://blog.naver.com/misterfm/222941749053,
174,신림역 헤센 더스타 오피스텔 상가 공급 정보,https://blog.naver.com/panthree/222734736342,
175,［신림역족발］문성골 족발집-양념족발 맛집추천,https://blog.naver.com/sujan1370/222875674770,
176,신림역 헤센더스타 남다른 메리트를 가진곳!,https://blog.naver.com/wpthdud0/222752350673,
177,신림역 필라테스 2022년도 같이 운동해요!,https://blog.naver.com/kvidopkgac/222602612864,
178,신림역 필라테스 pt 바디코드필라테스&amp;PT 꼼꼼상담 후기,https://blog.naver.com/ghdln1004/222989061876,
179,관악구/신림역 오첨지 오삼불고기 맛집,https://blog.naver.com/eysl55/222988851712,
180,신림역 고기집 복돈이생고기 가을엔 야장이지!,https://blog.naver.com/rudals0229/222873957631,
181,신림역 맛집 마라탕입구 꿔바로우도 싸고 배달도 많고 밥도... ,https://blog.naver.com/seojangbin/222988613971,
182,신림역 두루치기 로컬맛집 맛있으면돼지(구 옛날집) 추천해요!,https://blog.naver.com/june_621/222922706413,
183,사진 맛집 플레이인더박스 신림역점 / 24시 촬영 가능... ,https://blog.naver.com/xpel2529/222929621750,
184,신림역 카페 스턱(Stuck) 힙하다힙해,https://blog.naver.com/rudals0229/222858318825,
185,신림역횟집 가성비 좋은 어사출또 신림점,https://blog.naver.com/hwaja75/222880860170,
186,서울 신림역 맛집 백년불고기물갈비 신림점,https://blog.naver.com/qhrud1928/222991429524,
187,난곡사거리부근 상가주택 투룸 월세/햇살가득 따스한 집/신림역... ,https://blog.naver.com/mamam0818/222912005729,
188,신림역 헤센더스타 분양일정 및 분양가,https://blog.naver.com/oneroomjo/222728834695,
189,토핑 혜자! 신림역피자맛집 찾는다면 더피자 신림점,https://blog.naver.com/yen_q/222984453065,
190,[신림역 마사지] 24시간 편안하게 마사지를 받을 수 있는... ,https://blog.naver.com/sb3858/222844398668,
191,[서울 신림동 맛집] &lt;온달집 신림역점&gt; 안주 5개 먹고온... ,https://blog.naver.com/kiju134/222991427060,
192,신림역 안경 사무용 안심 오피스 업그레이드 행사 으뜸50,https://blog.naver.com/clee88/222983290691,
193,신림역 참치 이종대 거해참치 실장추천 코스!,https://blog.naver.com/asset394/222865969652,
194,신림역 카페 : 기글리하우스 / 힙한 분위기의 맛있는 도넛 맛집,https://blog.naver.com/qhqhkiss/222886638737,
195,"신림역 참치 맛집 이종대 거해참치, 신림동 모임장소로도 추천",https://blog.naver.com/qp_o_qp/222919113655,
196,"신림역 맛집 미남참치 1인 45,000원 스페셜코스",https://blog.naver.com/sasabana/222969736888,
197,신림역 헤센더스타 오피스텔 잔여세대 공급,https://blog.naver.com/lll0w0/222870563599,
198,신림역 미용실 24시타임헤어 클리닉 후기,https://blog.naver.com/worker_park/222988098694,
199,신림역생리통 한의원 치료 생리전증후군,https://blog.naver.com/jjhyug1/222745902087,
200,서울 오피스텔 분양 신림역 헤센 더스타 정보,https://blog.naver.com/romeoh/222775755264,
201,서울 아파트 분양일정 신림역헤센 더스타 정보,https://blog.naver.com/x4488/222784286562,
202,[신림] 신림역 취미미술 그림화원에서 아이패드드로잉 4주... ,https://blog.naver.com/agsio2/222941407178,
203,신림역 만성찬팅 가성비 중식당 간단하게 술 한잔 하기 좋은곳,https://blog.naver.com/bitcoin-news/222918720619,
204,"신림역 4번출구 길거리음식: 계란빵, 호떡, 건어물",https://blog.naver.com/oldlove1232/222984790365,
205,"신림역 술집 이자카야 꼬치 전문점, &lt;진화로&gt;",https://blog.naver.com/noori_world/222989182999,
206,"12월 서울기행 - 신림역, 더현대서울",https://blog.naver.com/ckk_319/222966148884,
207,"신림역오피스텔급원룸  분리형,엘리베이터.전용7평... ",https://blog.naver.com/city3ssuk/222889246347,
208,신림역 식당 막국수 만두 신림 맛집 &apos;막불감동&apos;,https://blog.naver.com/happylife5522/222986431083,
209,신림역술집 모녀(feat. 신림 전통주 전문점),https://blog.naver.com/buzabooboo/222986784890,
210,육질의 신림역양꼬치...전통의 양꼬치 강자 성민양꼬치 신림역... ,https://blog.naver.com/mittlivsom/222926478015,
211,"신림역 카페, 외국감성 분위기 깡패 로드트립 커피 한 잔",https://blog.naver.com/teawung10/222971439819,
212,센트레빌335 신림역 오피스텔 공급정보,https://blog.naver.com/namimi73/222613564190,
213,신림역 아늑한 카페 : SUBE 다녀왔어요,https://blog.naver.com/tlfdms19/222981193465,
214,신림역피부과 염증이 갈수록 심해진다면 원인을,https://blog.naver.com/pvnan330k/222978927575,
215,신림역밥집 엽전식당 가성비 좋은 메뉴 안주 추천,https://blog.naver.com/alladress/222726612198,
216,당곡역 맛집 모듬숙성회 &amp; 알탕 맛집 신림역 횟집 날밤포차,https://blog.naver.com/pnw5052/222985221560,
217,신림역 필라테스 자세교정은 무조건 필수!,https://blog.naver.com/kvidopkgac/222543770756,
218,가성비 최고 신림역 맛집,https://blog.naver.com/y104cm/222684979010,
219,먹고 싶어 방문한 신림역 신림 매운 등갈비찜 내돈 내산 후기,https://blog.naver.com/daka1122/222962968445,
220,［신림한식］푸짐한식당-신림역집밥제육쌈밥 추천(내돈내산),https://blog.naver.com/sujan1370/222849291498,
221,관악구 신림동 신림역 오피스텔 투룸 신축빌라 분양 매매,https://blog.naver.com/fghhtdfgh89/222861364590,
222,센트레빌335 신림역 오피스텔 정보,https://blog.naver.com/namimi73/222648187397,
223,신림역 센트레빌 335 오피스텔 정보,https://blog.naver.com/sp0110/222583742539,
224,신림역 지리산삼계탕 신림점에서 몸보신하고 왔어요~,https://blog.naver.com/leeb000/222873933152,
225,신림역 / 플레이 인 더 박스,https://blog.naver.com/gptjd1212/222965618590,
226,초역세권 신림역 헤센더스타,https://blog.naver.com/mejjaing/222838554225,
227,신림역 술집 _ 다양한 술이 있는 안주 맛집 꿈당,https://blog.naver.com/cherrycokes2/222980012364,
228,신림역 삼겹살 회식하기 좋은 술집 왕성정육식당,https://blog.naver.com/an11778/222925809245,
