,title,link,description
667,"신림역 백순대 맛집, 관악 해남 [위치/가격]",https://blog.naver.com/h_over/222990180520,
668,신림역PT 코어운동 2가지를 함께 알아보아요!,https://blog.naver.com/ddxqcn58/222728639985,
669,신림 삼겹살 맛집 &lt;삼삼당&gt; 신림역 고기집 데이트 추천!,https://blog.naver.com/qnwkalswn/222352492739,
670,신림역 술집 안주 퀄리티가 미쳤어요! 오동포차,https://blog.naver.com/dlgyqja125/222972922635,
671,매~콤 하던 신림역 닭갈비,https://blog.naver.com/song21o1c/222649388336,
672,신림역 마블링이 눈꽃같은 와규,https://blog.naver.com/mjda20/221686818288,
673,신림역 맛집 푸드피아 계란말이김밥 최고!,https://blog.naver.com/lessismoremin/222934746462,
674,분위기 삽지리는 신림역 달맞이이모네,https://blog.naver.com/dyngzzang36/222608385596,
675,체형평가로 운동 솔루션을 제공하는 신림역 필라테스,https://blog.naver.com/siempre_jh/222990127702,
676,신림역 분위기 좋은 카페 &quot;수베 sube&quot; 재방문의사 100%,https://blog.naver.com/thgusdl8709/222988652686,
677,보라매맛집 가성비좋은 신림역 한우 룸식당 명가,https://blog.naver.com/merrishop/222689797018,
678,"신림역도수치료 허리디스크, 도수치료로 해결해요",https://blog.naver.com/hana_000/222986129757,
679,신림역 종로빈대떡 해물파전 잔치국수 먹기,https://blog.naver.com/biology_kim/222739130321,
680,신림역 모임장소 럭셔리한 한우차돌삼합,https://blog.naver.com/sun2bin2/222943850947,
681,[내돈내산] 신림역 카페 디저트문 후기  / 수제케이크 끝판왕 카페,https://blog.naver.com/9563kkk/222985183755,
682,신림역 맛집 맛있는 동치미막국수 막불감동,https://blog.naver.com/nanacook/222654376996,
683,[신림역 술집] “모녀” 다양한 전통주와 한식이 있는 신림역 맛집,https://blog.naver.com/g980805119/222987748763,
684,신림역 헬스장 리뉴얼 1차 사전등록 진행 중,https://blog.naver.com/jamaica8828588/222969531692,
685,"신림 포장마차 타코야끼 맛집... 타코야끼 찐맛집, 신림역 4번출구)",https://blog.naver.com/hommini_/222991672217,
686,신림사주 신림역 사주 잘 보는 곳 추천 / 관악구 철학관... ,https://blog.naver.com/tiffany_f9/222702043756,
687,신림역디저트 맛집 《놀러와플》 존맛 와플&amp;스무디! 신림역카... ,https://blog.naver.com/annchoi758/222956131130,
688,"[신림 카페] 신림역에서 공부할 대형 카페를 찾는다면?, 신림역... ",https://blog.naver.com/gjdywjd1/222990944945,
689,밥이 무한리필되는 신림역 7번출구 마라탕집::라공방 후기,https://blog.naver.com/i963258741/222973151947,
690,와규가 맛있는 신선했던 신림역 맛집 부뚜막에서 와규500... ,https://blog.naver.com/coom91/222137904921,
691,[신림역미용실] 준오헤어 신림역1호점 해인쌤 톤다운 전체염색... ,https://blog.naver.com/leejiseon_0_/222966230480,
692,"만성찬팅, 중국보다 더 중국같은 신림역 중식집",https://blog.naver.com/tndud2620/222472230514,
693,"신림역닭강정, 신림역치킨은 갓 튀겨주는 정석닭강정 신림점",https://blog.naver.com/mam0515/222696322058,
694,신림역 아웃백 런치 기브미파이브 &amp; 슈림프아라비아따 (내돈내산),https://blog.naver.com/lovesongbaby/222972301327,
695,"[관악산 맛집] &apos;오장동 흥남집 신림직영점&apos;, 신림동 신림역 맛집",https://blog.naver.com/mardians/222769890247,
696,신보라매 두산위브 관악구 아파트 신림역 당곡역 역세권,https://blog.naver.com/vict89/222444187060,
697,동네분식집으로 최고 손칼국수잘하는집 신림역 관악구 엄마손만두,https://blog.naver.com/jinijinihae/222978136730,
698,신림역네일 꼼꼼하게 잘하는... 네일리스트 네일나린 / 신림네일,https://blog.naver.com/nayhs/222774212757,
699,신림역 점심 돈우코츠라멘 건강안식사,https://blog.naver.com/huihee98/222958217714,
700,신림역 헬스장 움츠러든 어깨를 펴보자,https://blog.naver.com/ddxqcn58/221726632114,
701,[서울/신림] 신림역 맛집 연하남에서 연어 즐기기!,https://blog.naver.com/jnr4518/222789809044,
702,신림역도수치료 미리 바로잡기,https://blog.naver.com/skaks2674/222980348170,
703,신림역 맛집 모녀 프레쉬한 쌈닭과 닭똥집 빙탄복 안주 맛집,https://blog.naver.com/qkqhtlzld95/222957449460,
704,[서울/관악] 신림역 신사리 즉석떡볶이 먹고 왔습니다,https://blog.naver.com/how_g/222667664918,
705,신림역 점심 시골장칼국수,https://blog.naver.com/huihee98/222950966276,
706,당곡역 맛집 날밤포차 오붓한 분위기의 신림역 횟집,https://blog.naver.com/icaruse2/222983169175,
707,관악] 신림보쌈 찾으시는 모든 분들 주목! 30년 전통 신림역보... ,https://blog.naver.com/creamchocolatetart/222971863581,
708,신림역오피스텔 프라비다트라움월세 신림역원룸월세... ,https://blog.naver.com/hinano00/222984531439,
709,"신림역 헬스PT / YOU&amp;I GYM 신규오픈 이벤트 안내, 성공적인... ",https://blog.naver.com/youni_gym/222992253121,
710,신림역 족발집 : 일미족발 (Feat. 14차 수요족발회),https://blog.naver.com/bsb7411/222687002643,
711,신림역 틈새라면... 빈틈없이 매운맛!(+얼마나 맵냐? 정보),https://blog.naver.com/wind4275/222953824144,
712,신림역한의원 야간에도 교통사고 입원 가능해서 좋았던,https://blog.naver.com/insunoo/222652292626,
713,[소곱창/신림역] 곱창나라 / 통통하고 고소한 소곱창맛집,https://blog.naver.com/hyeppylog_/222980125273,
714,신림역 곱창 맛집 &apos;신촌황소곱창 신림직영점&apos; 모듬세트 맛있고... ,https://blog.naver.com/0066olivia/222990694649,
715,신림역 헬스장 그룹 트레이닝 러너스하이 피트니스,https://blog.naver.com/gmlstkfkd1/222968080173,
716,"여름 별미 추천, 여름엔 시원한게 최고_신림역 맛집 &quot;막불감동... ",https://blog.naver.com/polianna825/222764846116,
717,신림역 술집&quot;경자식당&quot;맛과 분위기 한 번 들리면 단골이 될 수... ,https://blog.naver.com/ekgus1633/222968225306,
718,신림 수제버거. 신림역 햄버거 추천 시티버거 신림점,https://blog.naver.com/jmj3034/222962976251,
719,"신림역 스윙댄스, 신림역 출빠 : 인더무드신림 북욱화양연화... ",https://blog.naver.com/ljh0276/222806176318,
720,[서울 신림] 신림역 붕어빵 검색하다가 찾은 레드 고구마 붕어빵,https://blog.naver.com/goldsilver93/222953755366,
721,신림역 점심 매운갈비찜 명동찌개마을,https://blog.naver.com/huihee98/222949141170,
722,신림역 회전초밥 쯔양이 다녀간 스시나마,https://blog.naver.com/dandinice/222978244294,
723,무인 프린트카페 신림역점,https://blog.naver.com/dohoop/222939093923,
724,신림역 정형외과 찾고 건강을 되찾아요,https://blog.naver.com/qtwd19ozye/222944026115,
725,신림역 단체석이 있는 룸술집 &lt;가야&gt;,https://blog.naver.com/pxly_1122/222968309934,
726,"네일나린, 신림역 네일샵 추천! 겨울 니트네일 맛집",https://blog.naver.com/ha0723ha/222979672274,
727,신림역 고기뷔페 무한리필 고기싸롱 찐후기,https://blog.naver.com/asy140526/222970944124,
728,신림역 닭갈비 춘천집에서 옛날 닭갈비 먹고 왔어요,https://blog.naver.com/bluewins84/222633909515,
729,신림역 더블역세권 신림에스포레 오피스텔 분양 및 홍보관 안내!,https://blog.naver.com/ksi0067/222770930602,
730,신림역 맛집 전라도시네마에서 신림백순대 택배 최고의 가성비,https://blog.naver.com/olanska/222952270232,
731,신림 타코야끼 맛집 내돈내산 후기(신림역 4번출구),https://blog.naver.com/iriny13/222962910228,
732,신림역pt  운동하기 좋은곳,https://blog.naver.com/kheqnddl/222936189931,
733,[레인드랍커피 신림본점] 분위기 좋은 신림역 디저트 카페,https://blog.naver.com/jang9369/222955572575,
734,신림역에서 간만에 먹어보는 점심식사 파스타 맛집 오늘은... ,https://blog.naver.com/sungwond8586/222794288433,
735,신림역 PT 양쪽 다리에 균형을 맞춰보자,https://blog.naver.com/ddxqcn58/221687151794,
736,［신림역햄버거］밀리언버거-수제버거맛집 추천드려요.,https://blog.naver.com/sujan1370/222681876269,
737,신림 양꼬치 고소해 성민양꼬치 신림역점,https://blog.naver.com/dmswntkfkd04/222945484164,
738,신림역추나요법한의원 통증 치료 문제없이,https://blog.naver.com/hwisoo1981/222980669395,
739,신림역족발 귀한족발 신림점 쫀득하고 부드러운 족발 &amp; 보쌈... ,https://blog.naver.com/jinheeloo/222804404251,
740,신림역 김치찌개의집 낭풍,https://blog.naver.com/lsh1000j/222962713464,
741,"신림역넓고싼방,전세5000만원 3층,대출가능,월세 500/30만원",https://blog.naver.com/city3ssuk/222675567762,
742,하루필름 신림점 솔직 후기 | 신림역 셀프사진관 추천 | 셀프... ,https://blog.naver.com/affettus0/222988367553,
743,［신림역 안동찜닭］홍수계찜닭 타임스트림점 치즈찜닭... ,https://blog.naver.com/sujan1370/222709376610,
744,센트레빌335 신림역 오피스텔 역세권 입지,https://blog.naver.com/rtm630508/222609465013,
745,신림역 맛집 고앤고 본점 생삽겹갈비가 맛있는 고깃집,https://blog.naver.com/wkdgksk0605/222646601812,
746,신림역 카페 아인슈페너 티라미수가 맛있던 디자이너리 카페,https://blog.naver.com/clueclue0106/222900878392,
747,신림 맛집 신림역족발 신림족발 문성골족발집 양념족발 대... ,https://blog.naver.com/kenoop/222733458750,
748,"[신림역 맛집] 신림 큐슈라멘, 신림역 숨은 맛집은? 혼밥 라멘집... ",https://blog.naver.com/gjdywjd1/222989116347,
749,신림역교통사고한의원 때가 늦지 않게 초기에 치료받자,https://blog.naver.com/beskinclinic/222985918596,
750,[신림 킴쓰해물로스]신림역 3번출구 해산물&amp;소고기 철판구이... ,https://blog.naver.com/youlmu2/222860818684,
751,신림역 고기집 부뚜막 와규ㅠㅠㅠㅠ,https://blog.naver.com/fsh1329/222554522859,
752,[신림맛집] 막국수에서 새우교자까지.. 신림역 5번출구... ,https://blog.naver.com/cghpbs/222973173018,
753,［신림역 쌀국수］사이공본가 신림점-가성비좋은 신림동... ,https://blog.naver.com/sujan1370/222696167059,
754,{신림 순곱동주} 신림역 곱창전골맛집,https://blog.naver.com/dzcreative/222974789725,
755,신림역 카페 놀러와플,https://blog.naver.com/yeji7758/222957686411,
756,신림역 또 찾게 되는 더피자 신림점 내돈내산 솔직후기,https://blog.naver.com/jjaelonging/222978585451,
757,신림역치과 부정교합 심할 때는?,https://blog.naver.com/bother516/222936188113,
758,"[신림역 맛집] 줄서는식당 맛집 나도가봤다, ‘신림춘천집 본점’",https://blog.naver.com/wamin_ve/222952059062,
759,신림역 안경원에 옐로우플러스 안경이 들어왔어요,https://blog.naver.com/ahdmsektmf/222664688061,
760,"신림역 한의원, 구안와사 원인부터 치료까지",https://blog.naver.com/jjhyug1/222183870582,
761,"신림역 술집 앤쓰롤앨리, 하이볼 와인 칵테일 다양한 주류!!",https://blog.naver.com/jjin_vely/222974597784,
762,[두리닭발앤쪽갈비] 안주가 맛있는 신림역 닭발,https://blog.naver.com/jang9369/222958583050,
763,"경기 시흥~신림역 잇는 연장 15km 신천신림선, 추진 준비... ",https://blog.naver.com/wholesome2na/222931756907,
764,[신림 준코] 신림역 노래타운 준코2호점,https://blog.naver.com/lmj7230/222961726237,
765,[서울] 신림역 샐러드 &quot;커스텀샐러드 신림&quot;,https://blog.naver.com/dmswls2737/222942893634,
766,신림역 헬스장 매끈하고 탄탄한 하체만들자,https://blog.naver.com/ddxqcn58/221506200649,
767,신림역 맛집 냉삼이랑 항정살 고기집! &lt;삼삼당&gt;,https://blog.naver.com/ksbeen0709/222938954077,
768,"바삭한 치킨에 편안한 분위기 , 신림치킨 신림역 1번출구 치킨... ",https://blog.naver.com/rhdms1157/222991927919,
769,[레인드랍커피]신림역 디저트카페 뚱샌드위치 맛집,https://blog.naver.com/dmdrkrjf/222955989865,
770,[REVIEW] 서울 신림역 블랙 앤 화이트 컨셉의 까눌레가... ,https://blog.naver.com/pink5835/222979875302,
771,신림역 네일 코델리아 핑크빛 파츠네일아트 받구왔어욤♥,https://blog.naver.com/hug387/221926713628,
772,신림역 고시원 신림동 고시텔 관악구 원룸텔 풀옵션... ,https://blog.naver.com/neoflat1116/222962199595,
773,신림역 &lt;다꼬야끼 오코노미야끼 야끼소바&gt; 내돈내산 솔직후기,https://blog.naver.com/fud9050/222952267278,
774,신림역 센트레빌335 청약 정보 확인,https://blog.naver.com/sp0110/222566275414,
775,신림역 정담은보쌈 보쌈맛집 인정(내돈내먹),https://blog.naver.com/ruddo7733/222960821848,
776,신림역치과 찾는 이유가 있는이유,https://blog.naver.com/plain10205/222954156977,
777,신림역꽃집 [프레리 플라워] - 엄마를 위한 꽃선물하기,https://blog.naver.com/marumj/222641640574,
778,신림역 점심 뼈해장국 정가네감자탕부대찌개,https://blog.naver.com/huihee98/222951435688,
779,신림역 더피자 킹쉬림프 체다치즈 후라이 반반피자로 먹어보기,https://blog.naver.com/zm_zzang/222983317686,
780,신림역 혼밥 돈까스 긴자료코에서 맛보다,https://blog.naver.com/everythingwhere/222979705154,
781,신림역 마사지 전문가에게 받는 쉼테라피,https://blog.naver.com/minjee1209/222590669799,
782,신림역 395m 분리식원룸 300/40,https://blog.naver.com/i_mcheon/222519742763,
783,신림역맛집 신림보쌈맛집 정담은보쌈 부모님 모시고 오기 좋은... ,https://blog.naver.com/kes_shop/222983084736,
784,신림역 롤러 팡팡 스케이트장 롤러장 신나게 고고씽,https://blog.naver.com/qkrtjddnr4989-/222983565501,
785,인문학걷기 107차. 서울 &lt;사당역~신림역&gt;,https://blog.naver.com/etoile1016/222991484997,
786,"[서울, 신림역 카페] 카페... 라떼, 신림 데이트 추천, 시점... ",https://blog.naver.com/hin02489/222988252029,
787,신림역 선불폰 앱 셀프 개통 통신비 절약하는 팁,https://blog.naver.com/karijin0512/222942265414,
788,"[신림역 이자카야]... 좋은, 분위기 맛집, 신림 하이볼 맛집)",https://blog.naver.com/ssujin_n716/222989483382,
789,"골프존파크 신림역점, 깔끔한 스크린골프 후기(단체 가능)",https://blog.naver.com/jminu310/222950693384,
790,신림동 맛집 / 신림역 포도몰 돈까스  모모야 신림점,https://blog.naver.com/leeb000/222608551129,
791,신림역 맛집 삼삼당 &amp; 스타벅스 신림타임스트림점,https://blog.naver.com/selhvcoy/222984063932,
792,신림역 주차장 주차비 할인 이벤트 별빛신사리 르네상스 쇼핑몰... ,https://blog.naver.com/heney1981/222965162734,
793,신림역 레인드랍커피 마카롱 맛집 신림 카페,https://blog.naver.com/uiyeonham/222971401557,
794,신림역 안경 가성비 좋은 국산 누진다초점 렌즈 업그레이드행사,https://blog.naver.com/lov2kang/222712100287,
795,신림역 술집 남빙고맥주 진짜 가성비 최강 맥주집,https://blog.naver.com/dayoff_91/221674190103,
796,"신림역 타임스트림 중식, 더차이",https://blog.naver.com/somethingcute/222623683547,
797,신림역 맛집 부추삼겹살딱이야 연말모임 냉동삼겹살이 맛있는 집!,https://blog.naver.com/qkqhtlzld95/222951517844,
798,"[신림역 맛집 토당골] 여기 또 가요? 능이삼계탕, 옻삼계탕... ",https://blog.naver.com/smile-daisy/222982192599,
799,[신림역 카페 밝을현] 아지트 있으세요? 요거트 맛집 밝을 현,https://blog.naver.com/smile-daisy/222975982602,
800,신림역이용 원룸전세 5000만원,https://blog.naver.com/city3ssuk/222504547973,
801,신림역술집 애견동반가능한 안주백화점,https://blog.naver.com/whqhrud0919/222938259794,
802,신림역 맛집 : 고기전문점에 삼겹살 먹으러!,https://blog.naver.com/mmminyeong/221907472054,
803,신림역맛집 가성비좋은 동치미막국수맛집 막불감동,https://blog.naver.com/wleoddl5774/222943595591,
804,신림역 덮밥 아롱별 식탁 식사와 술을 같이 곁들이는 곳,https://blog.naver.com/solarj_/222985339915,
805,신림역카페 흑임자 도넛맛집 배배꼬(종류/가격),https://blog.naver.com/l_s_stellae/222989090268,
806,"신림역 안주맛집 &apos;물멍포차&apos; 대방어+대광어 세트, 모듬조개탕 등... ",https://blog.naver.com/0066olivia/222988981880,
807,[신림역 레터링케이크] 또또케이크 첫구매 후기,https://blog.naver.com/dory____v/222949863098,
808,[두리닭발앤쪽갈비] 신림역 닭발맛집 무뼈직화닭발 치즈퐁듀... ,https://blog.naver.com/shr6148/222985193217,
809,"[서울 신림] 둘이 먹다 하나가 죽어도 모를 그 맛, 푸짐한 신림역... ",https://blog.naver.com/yesmiran/222975608290,
810,[신림] 신림역 실내포차  “기막힌 포차”,https://blog.naver.com/ranblog/222983550780,
811,[서울] 신림역 레터링케이크&amp;도시락케이크•카페드발렌느•,https://blog.naver.com/1ee_h/222986781399,
812,[서울_신림역 맛집] 우면관,https://blog.naver.com/hyeeeeeng/222987218564,
813,신림역 고기맛집 본화로,https://blog.naver.com/1227jeg/222983258716,
814,"신림역 맛집 ) 대원갈비 feat. 신림24시간 영업 , 돼지갈비... ",https://blog.naver.com/nus_0k/222953300601,
815,신림역 헬스 슬림+매끈 팔 라인 만들어요,https://blog.naver.com/ddxqcn58/221622242134,
816,신림 디자이너리 카페｜도림천 옆 신림역 카페,https://blog.naver.com/binladen0405/222939851994,
817,신림포도몰갔다 방문한 신림역 밥집,https://blog.naver.com/lee671344/222565204695,
818,[신림역] 마라탕 먹으러 온 라공방 신림점,https://blog.naver.com/hkw0620/222643748137,
819,신림역 쌀국수 맛집 갈비쌀국수 사이공본가 신림점,https://blog.naver.com/dmswntkfkd04/222952806289,
820,[신림역] 신림 갤러리카페 &apos;갤러리 카페 비찰&apos;,https://blog.naver.com/hyejini0321/222954826158,
821,얼큰하고 매운 설렁탕 맛집 신림역 한촌설렁탕,https://blog.naver.com/2henryblog/222551770654,
822,신림역 가성비 참치 9900원에 한돌참치 테이크아웃 해서... ,https://blog.naver.com/be-focus/222628961925,
823,신림역맛집 박재성의 메밀숯불닭갈비,https://blog.naver.com/vnfgkdntm73/222986441500,
824,신림역왁싱 브라질리언 전문샵 문왁싱,https://blog.naver.com/minjee1209/222540612772,
825,신림역 부드러운 목살 맛집 왕주먹(내돈내먹),https://blog.naver.com/ruddo7733/222964086231,
826,신림역 치킨 맛집 훌랄라 참숯바베큐 치킨,https://blog.naver.com/dbsldisjfwk/222923044768,
827,신림역 풀옵션 오피스텔 전세8000,https://blog.naver.com/woonjohouse/222986797996,
828,"도우다베이커리, 신림 빵집(관악구 신림역) 메뉴",https://blog.naver.com/als_wjd2720/222630779396,
829,[신림역사진관/신림셀프사진] 포토지바고에서 컬러 증명사진... ,https://blog.naver.com/tjddk742/222984491069,
830,신림데이트 기념일에 &quot;최후의 참치&quot; 신림역 참치 맛집,https://blog.naver.com/yeyepiano/222956688605,
831,신림역 PT 피티 우정바디프로필 비포애프터 확인해보세요!,https://blog.naver.com/wan4545/222639483048,
832,신림역 밥집 치즈카츠 예술! 돈까스 맛집 포도몰 모모야 신림점,https://blog.naver.com/wkddbsk308/222694548444,
833,신림역 참치 맛집 신림동 모임장소 추천 거해참치,https://blog.naver.com/mmpwl2/222981661463,
834,신림PT 신림역헬스장 러너스 하이 피트니스 신림 크로스핏,https://blog.naver.com/lavenderj-/222961328899,
835,신림역 해장국 맛집 현대옥 콩나물국밥 진한 후기,https://blog.naver.com/bongamlee/222980013953,
836,신림역 중국집 맛집 무궁화반점 가족외식 후기,https://blog.naver.com/lessismoremin/222934169818,
837,신림역맛집 가성비 굿:: 찐중국의 향기 만성찬팅,https://blog.naver.com/asset394/222545668909,
838,신림역 3번출구 무한리필 포차 / 배부르게 먹을 수 있는 신림... ,https://blog.naver.com/youlmu2/222696967989,
839,신림역 초밥 맛집 구영회 초밥,https://blog.naver.com/start_00/222987302800,
840,[신림맛집/신림치킨] 신림 치킨... 신림역점 참숯양념구이,https://blog.naver.com/mihye0310/222835831895,
841,[신림술집/ 린생사진관] 신림역술집 도장깨기 중! 안주가 맛있는... ,https://blog.naver.com/2sunjuu/222981101755,
842,신림역 맛집 두부삼합 고향순대국특이한 메뉴,https://blog.naver.com/like5183/222878725404,
843,신림역 고구마붕어빵 서울 붕어빵 맛집 솔직후기,https://blog.naver.com/kkaarraa/222954054417,
844,신림역 맛집 : 혼자서도 고기를 편하게 먹을 수 있는 신림... ,https://blog.naver.com/sweet1137/222715939603,
845,"신림역쌀국수 맛집 포비엣, 관악구쌀국수 넘버원",https://blog.naver.com/rajana/222934635803,
846,[신림역한정식] 신림강강술래 본점 한정식맛집으로 터줏대감인... ,https://blog.naver.com/aossinna/222959795618,
847,신림역 햄버거 아이들이 좋아하는 수제버거맛집 밀리언버거,https://blog.naver.com/arsoap/222802193799,
848,"신림역 2차 술집:: 하노이맥주밤거리, 분위기 최고 힙한 술집!",https://blog.naver.com/ppppearl/222939011002,
849,분위기 좋은 신림역 브런치 카페 도우맨션,https://blog.naver.com/vbvb877/222941401895,
850,신림동 모임장소ᅵ신림역 참치 이종대 거해참치,https://blog.naver.com/ghdln1004/222934165980,
851,신림역 헬스장 올바른 레그프레스를 알아보자,https://blog.naver.com/fpeoplew1/222570406775,
852,신림역 루프탑 카페 : 수베 Sube,https://blog.naver.com/qhqhkiss/222534748681,
853,신림역 순대타운 3층 &apos;해남&apos; (+신림역 공영주차장 정보),https://blog.naver.com/wind4275/222951273441,
854,신림역 맛집 백순대 순창 &amp; 막불감동 막국수 맛집 후기,https://blog.naver.com/tmej0916/222988826078,
855,"관천로 문화플랫폼 S1472, 신림역 공간대여, 신림역 전시회",https://blog.naver.com/hex79/222617959013,
856,신림역 월주차ㅣ자리가 생겼어요!,https://blog.naver.com/zoomansa003/222987971929,
857,신림역 닭발 맛집 두리닭발앤쪽갈비 국물닭발 후기,https://blog.naver.com/royal_milk_tea_shake/222968835644,
858,신림역 헬스장 소도구를 이용해서 내몸에 자극주기!,https://blog.naver.com/ddxqcn58/222025656606,
859,신림역 가족모임 맛집 추천식당 정담은보쌈 신림점,https://blog.naver.com/asy140526/222967499714,
860,맛있는 신림역 디저트 카페 레인드랍 커피 신림점 후기!,https://blog.naver.com/gkems333/222954477476,
861,신림역 맛집 먹을수록 맛있네 양꼬치,https://blog.naver.com/kwpjulie/221223939526,
862,"신림역빌라 2룸전세 넓은거실,베란다 신축급리모델링... ",https://blog.naver.com/city3ssuk/222753642978,
863,신림역보쌈 흥부보쌈 보쌈정식,https://blog.naver.com/lea332/222984844038,
864,[강강술래/신림]주차발렛 1인... 강강술래 후기 신림역맛집,https://blog.naver.com/pinusgomsol/222991339654,
865,신림역 맛집 매콤 쭈꾸미삼겹살 쭈삼!,https://blog.naver.com/kwpjulie/221231675388,
866,[관악구/신림역] 가정식 백반 맛집 &apos;푸짐한 식당&apos;,https://blog.naver.com/sftry75/222985560868,
867,신림역 헬스 스텝박스를 이용해서 강한 하체운동하기,https://blog.naver.com/fpeoplew1/222591967096,
868,깔끔하고 맛있는 신림역쌀국수 [포비엣],https://blog.naver.com/jee2603/222938625787,
869,[서울/관악] 신림동 옛날통닭 맛집 보드람치킨 신림역점.,https://blog.naver.com/jgh1231/222933071141,
870,숲칼프신림역점/ 신림두피 관리 정말 잘해주시네요 ^^,https://blog.naver.com/gowjddnre/222980222387,
871,신림디저트 카페 모임장소 신림역 카페 우리동네맛집 @디저트문,https://blog.naver.com/arsoap/222641261070,
872,신림역 카페］디저트문-디저트카페 모임장소로 최적화된 신림... ,https://blog.naver.com/sujan1370/222683165990,
873,신림역 기글리하우스:) 도넛이맛있었던카페,https://blog.naver.com/wldms1dh/222930961268,
874,신림역닭발 매콤한 가야불닭발,https://blog.naver.com/issakr/222978550470,
875,[ 신림역 사주 철학관 ] 평점9.9점 의 실력자 천명 신림 산정... ,https://blog.naver.com/j_eunkim/222650582226,
876,신림역 삼겹살 맛집 &apos;삼삼당&apos;에서 가성비 좋은 냉동삼겹살을... ,https://blog.naver.com/dschoi4080/222398267392,
877,[서울/신림 술집] 눈 오는날 막걸리 한잔~ 신림역 해물 파전... ,https://blog.naver.com/tlarud00/222986584934,
878,신림역 속눈썹펌 뷰티래빗에서 예뻐지세요 :),https://blog.naver.com/blacksmi/222973432585,
879,짜장면이 맛집인 신림역 중국집 아리차이(내돈내산),https://blog.naver.com/soyeon931018/222978601714,
880,신림동빌라 신림역도보5분 테라스를 품은 넓은 3룸 지금... ,https://blog.naver.com/8584dream/222967477850,
881,"신림역 오피스텔 헤센더스타 주거, 상가 최신정보",https://blog.naver.com/honeyjoun/222738830869,
