,title,link,description
229,"숯불닭갈비 한점.. 어때..? (신림역맛집, 박재성메밀숯불닭갈비)",https://blog.naver.com/leehyein0101/222979623870,
230,"신림역주변원룸 신축급전세1억,엘리베이터있음",https://blog.naver.com/city3ssuk/222862354183,
231,"신림역디저트, 신림역카페를 찾으시면 와플 종류 대박많은... ",https://blog.naver.com/sigk00/222898843745,
232,신림역 술집 우대갈비와 쭈꾸미볶음 수지상회,https://blog.naver.com/stsu13/222935672921,
233,[서울/신림역] 혼술하고 싶을때는 칵테일 밤에서 즐겨보세요!,https://blog.naver.com/fjv123/222991203217,
234,신림역오뎅바 신림새우튀김맛집 부산오뎅바 이자카야,https://blog.naver.com/hwaja75/222886404488,
235,신림역 술집 수지상회 바베큐플레터 하이볼 데이트,https://blog.naver.com/qkqhtlzld95/222982679327,
236,센트레빌335 신림 신림역 오피스텔 상가 공급 정보,https://blog.naver.com/ji_eun_kr/222681109370,
237,신림역 참치 살안찌는 술안주 맛집 신림 거해참치,https://blog.naver.com/kagama007/222868598719,
238,신림역 맛집 순대타운 신림 전주익산 3대천왕 백종원 추천 맛집,https://blog.naver.com/kdanylog/222985041090,
239,"서울대입구역 고시원,신림동 고시원,신림역,봉천역 고시텔... ",https://blog.naver.com/lege/222937836608,
240,[관악구] 신림 신원시장 파먹기2_생생조개 : 가성비 좋은 신림역... ,https://blog.naver.com/slumkill/222949394913,
241,신림역 신림 백순대 맛집 순대타운 | 순창,https://blog.naver.com/fairylamp_/222973576949,
242,신림역 고기집 끝내주는 월화고기 무항생제돼지고기!,https://blog.naver.com/house5213/222874020201,
243,센트레빌335 신림역 오피스텔 공급정보,https://blog.naver.com/smk0107/222569133005,
244,신림고기집/신림역고기집 추천: 가성비 좋았던... ,https://blog.naver.com/rami_c/222866614377,
245,신림역 맛집 미남참치 :: 참치 무한리필 퀄리티 최고,https://blog.naver.com/syp15/222991298518,
246,신림역치과 맞춤형으로 꼼꼼하게,https://blog.naver.com/histo3330/222893425075,
247,신림 삼계탕 내시경 후 기력 회복하러 신림역 포도원삼계탕,https://blog.naver.com/qwer54041/222971815668,
248,신림 다이어트 고민 중이라면 신림역 샐러드 커스텀샐러드 신림점,https://blog.naver.com/yen_q/222986963265,
249,신림역치과 덧니교정으로 미소를,https://blog.naver.com/swim4965/222968139535,
250,신림역 필라테스 안심하고 운동할 수 있는 곳,https://blog.naver.com/kvidopkgac/222506485801,
251,신림역샤브샤브 추천! 명동칼국수맛집 타임스트림 신림동 맛집,https://blog.naver.com/wkddbsk308/222881762174,
252,신림역 술집 시장을여는사람들 삐까뻔쩍 젊은이들 노는 곳이... ,https://blog.naver.com/uririn_nice/222988672516,
253,신림동 신림역 빨래방 대박~~!!/운동화세탁/화이트365 신림2호점,https://blog.naver.com/dreamowners/222699007948,
254,신림역원룸 418m만 가면 남쪽방 월세,https://blog.naver.com/i_mcheon/222666178791,
255,[리뷰] 허리통증싹 신림역 마사지 신림풋샵,https://blog.naver.com/skfhd0_0/222988171832,
256,신림역 쌀국수 사이공본가 갈비쌀국수랑 반미랑~맛있는 혼밥 냠,https://blog.naver.com/leeb000/222883572767,
257,"신림동, 신림역 참치 이종대 거해참치♡",https://blog.naver.com/cateye99/222817356277,
258,여성 전용 신림역 pt- 폴인핏 신림점,https://blog.naver.com/hsshin0212/222985498067,
259,신림역 필라테스 1석3조의 효과를 가져가자,https://blog.naver.com/kvidopkgac/222468332321,
260,"[서울맛집/신림역맛집] 신림역 5번 출구 막불감동, 신림역 카페... ",https://blog.naver.com/manjichoi/222876495768,
261,"신림역 이자카야, 조용한 술집을 찾는다면 &quot;길회뜨다&quot;",https://blog.naver.com/ddi02084/222986620970,
262,[서울 신림 맛집] 가성비 좋은... 추천 / 신림역 혼밥 수제 햄버거... ,https://blog.naver.com/daka1122/222955522673,
263,신림역 카페 [스턱],https://blog.naver.com/jhbwwg1122/222961958318,
264,해남_ 서울 관악 신림역 백순대 맛집,https://blog.naver.com/salchisal_/222981799026,
265,[신림미용실 추천/신림역 미용실 추천] 이철헤어커커 신림점... ,https://blog.naver.com/eoudy/222908434526,
266,신림역/서원역 쌈밥 맛집 시골쌈밥 리뷰_2022년 11월,https://blog.naver.com/ssd3539/222977184178,
267,센트레빌335 신림역 공급정보,https://blog.naver.com/sion6252/222623260139,
268,신림역술집 안주 맛있고 분위기 좋은 술집 추천 오늘밤,https://blog.naver.com/khy8097/222985866539,
269,신림역사진관 포토지바고,https://blog.naver.com/2park_gazi/222980885088,
270,가성비좋은 신림 횟집 어사출또 신림역점,https://blog.naver.com/sunset026/222845166508,
271,[신림] 신림역 취미미술 그림화원에서 아이패드드로잉 4주... ,https://blog.naver.com/agsio2/222947670133,
272,[신림역 PT] 신림 헬스 PT 추천 휘트니스피플 신림점 후기... ,https://blog.naver.com/eoudy/222879903790,
273,서울 신림 요리주점 신림역 술집 오늘밤 분위기좋은술집  후기,https://blog.naver.com/cu_u123/222989801326,
274,신림역 회식장소로 좋은 삼합당 하이볼까지 맛있어,https://blog.naver.com/darangee_/222978334634,
275,신림역 헬스 닐링스쿼트로 힙에 자극 받아보자,https://blog.naver.com/ddxqcn58/222552346544,
276,신림역 근처 맛집 :: 누린내 없이 맛있는 신선한 제주복돈... ,https://blog.naver.com/bht0330/222992038283,
277,신림역 햄버거 &apos;담백한 밀리언 수제버거&apos;,https://blog.naver.com/stenojoe/222817615709,
278,신림역 저렴하면서 맛있는 사시미가 있는 카미사토,https://blog.naver.com/28ssan/222877570891,
279,[신림역 맛집] 백순대 포장 맛집 호남집 백순대,https://blog.naver.com/sarah_16/222990749516,
280,신원시장 착한 생칼국수 가성비 좋은 신림역 맛집,https://blog.naver.com/lessismoremin/222975968041,
281,[신림 카페] 샌드위치맛집 신림역 커피숍 / 레인드랍커피 신림본점,https://blog.naver.com/similan_/222989196365,
282,폴인핏 신림점｜신림역 여성 전용 PT 추천,https://blog.naver.com/ynnchoi/222986277348,
283,신림역족발 야들야들 귀한족발,https://blog.naver.com/kagama007/222806398801,
284,신림역샐러드 &apos;커스텀 샐러드&apos; 훈제오리샐러드+그릭요거트,https://blog.naver.com/ellie_agnes/222990421935,
285,신림 데이트코스/신림역 맛집 추천: 박재성의 메밀숯불닭갈비... ,https://blog.naver.com/rami_c/222857299601,
286,신림역 필라테스 여성들은 꼭 해야하는 운동!,https://blog.naver.com/kvidopkgac/222397425552,
287,"신림역 밥집, 마라탕먹으러 라공방 다녀왔어요!",https://blog.naver.com/inhee_0428/222974905533,
288,신림역 갈비 대원갈비 에서 배부르게 저녁 먹었어요,https://blog.naver.com/teawung10/222954889122,
289,신림역미용실 24시타임헤어 남자컷,https://blog.naver.com/su06135/222979622414,
290,신림역 횟집 어사출또 신림역점 한잔하기 좋은 신림역 포차,https://blog.naver.com/kyoung8932/222839662473,
291,강원도 원주 가볼만한 곳 - 신림역 폐역,https://blog.naver.com/alsduddl525/222989657244,
292,신림역 필라테스 함께 하는 운동으로 효과업!,https://blog.naver.com/kvidopkgac/222432387727,
293,가성비 쩌는 신림역 술집 스모크하우스 앤 펍,https://blog.naver.com/28ssan/222833510342,
294,신림역 헬스장 군살없이 탄탄한 상체를 만드는 방법,https://blog.naver.com/fpeoplew1/222844955730,
295,신림춘천집 본점 / 신림 맛집 / 신림역 닭갈비,https://blog.naver.com/xpel2529/222914011461,
296,"신림역넓은원룸 베란다까지 8평사용하고 저렴 1000/36,관4만",https://blog.naver.com/city3ssuk/222892649483,
297,신림 순대타운 주차: 백순대 삼촌네 신림역 공영주차장으로!,https://blog.naver.com/doalchl12/222858518971,
298,신림역 혼술하기 좋은 작은 술집 파이팅,https://blog.naver.com/28ssan/222867619356,
299,교토 신림역 초밥 맛집,https://blog.naver.com/gmlstkfkd1/222973725880,
300,신림역 마라탕 &apos;라공방&apos; 골라 담아 먹기,https://blog.naver.com/fdu9s8ewi/222988937224,
301,"(신림역 도보8분 아파트) 신림동부 임장기(신림선, 2호선... ",https://blog.naver.com/coala_12/222750960597,
302,신림역 참치 _ 미남참치 무한리필,https://blog.naver.com/ddongddongju/222842433414,
303,"신림역,봉천역10분 빌라급매 가격다운 가성비갑",https://blog.naver.com/city3ssuk/222851005729,
304,신림동고기집 육즙퐝 목살맛집 인생고기 신림역점 후기,https://blog.naver.com/bobae002/222979226783,
305,신림역 안경 EOSSEO(어서) 안경테 입고,https://blog.naver.com/ahdmsektmf/222858051460,
306,신림역 피티 체지방감량에 효과가 좋은 운동법!,https://blog.naver.com/ddxqcn58/222534738233,
307,"신림역 라공방 마라탕,마라샹궈 맛있는집",https://blog.naver.com/acts0191/222984196406,
308,신상 신림역술집 추천! 안주 맛집 지구소주 유명한 신림술집... ,https://blog.naver.com/wkddbsk308/222867655344,
309,신림선 최고의 수혜지 신림역 헤센 더 스타 오피스텔 분양!... ,https://blog.naver.com/lecture4050/222782221438,
310,[신림역 신대방역 맛집] 스시모도리 회전초밥 추천,https://blog.naver.com/june_621/222847867884,
311,신림역 막국수 새우 만두 맛집 막불감동,https://blog.naver.com/9300420/222980799782,
312,신림역 필라테스 함께 하는 운동으로 건강하게!,https://blog.naver.com/kvidopkgac/222572908640,
313,신림역 중국집 아리차이 우동 먹어봄,https://blog.naver.com/asfhak777/222985390864,
314,신림역 카페! 카페 수베 SUBE 분위기 좋은 카페 추천 ღ / 신림... ,https://blog.naver.com/aus567/222946776130,
315,입소문난 신림역 고구마 붕어빵 직접 먹어본 후기+위치 알려드림,https://blog.naver.com/got001/222984214965,
316,서울 신림동 맛집 신림역 백순대 볶음 신림 순대타운 &apos;전주... ,https://blog.naver.com/baeandpark/222985165004,
317,육즙가득 떡갈비가 맛있는 신림역 신원시장 맛집 [양촌떡갈비],https://blog.naver.com/ksh85245611/222984250399,
318,"신림동 건강검진, 신림역 종합건강검진 ‘삼모라인내과의원’... ",https://blog.naver.com/kyr002/222988510029,
319,"신림역 카페, 신림 카페, 신림 24시간 카페 &quot; 디저트 문 &quot;",https://blog.naver.com/tjdalsdlz2/222832903121,
320,20220820 신림역 &apos;그레잇&apos; + &apos;사당역&apos; 심비디움,https://blog.naver.com/soyun9393/222878889134,
321,신림역원룸 옵션 빠방하고 평수까지 넓은 한신,https://blog.naver.com/talktalk0828/222982496668,
322,신림역 타코야끼 포장마차 포장 후기,https://blog.naver.com/tndns6010/222984493860,
323,"신림역 필라테스, 더바디핏 필라테스 신림점 운동후기",https://blog.naver.com/aji7737/222982591508,
324,220723 신림역 코믹존 방문,https://blog.naver.com/medicv/222826151273,
325,신림역맛집 덮밥전문점 배고픈 덮밥이,https://blog.naver.com/geniusindol/222797933907,
326,[신림역 맛집] 스모크 하우스 앤 펍 - 가성비만점,https://blog.naver.com/bears18/222856841497,
327,"신림역디저트카페추천, 도넛이 맛있는 기글리하우스",https://blog.naver.com/sunset026/222856362473,
328,"[관악 / 신림역] 신림 피자, 배달맛집 더 피자 (THE PIZZA)... ",https://blog.naver.com/with_aki/222988305963,
329,신림역 맛집 삼삼당,https://blog.naver.com/jieun4243/222778690008,
330,[서울 신림동 초밥] 신림역 7번 출구 르네상스 건물 뒤 이자카야... ,https://blog.naver.com/daka1122/222955452663,
331,신림역치과 고민 탈출~!,https://blog.naver.com/plain10205/222972770269,
332,신림역치과 치아 건강을 되찾기 위해,https://blog.naver.com/busy3905/222966037842,
333,"신림역 카페 수베 SUBE, 데이트 추천하는 루프탑 카페",https://blog.naver.com/bobitreasure/222987555065,
334,신림역 족발 맛집 문성골족발집 양념족발이 맛있었던곳,https://blog.naver.com/8555tjsdhr/222981889374,
335,신림역 맛집 무궁화반점 해물쟁반짜장 불맛 가득 짬뽕,https://blog.naver.com/qkqhtlzld95/222975440261,
336,신림역정형외과 갑자기 어깨가 아플때,https://blog.naver.com/k_sun0420/222979068984,
337,신림역미용실 박승철헤어스투디오 클리닉 후기!,https://blog.naver.com/angel153c/222988798022,
338,"신림역 맛집, 샌드위치 샐러드 읍천리 382 신림점",https://blog.naver.com/11ansgallry/222970317988,
339,신림역맛집 파스타입니다,https://blog.naver.com/jieun4243/222793774805,
340,신림역 술집 금별맥주 안주가 맛있어,https://blog.naver.com/dbsk5910/222989658480,
341,"데이트, 모임하기 좋은 이자카야 분위기 신림역술집 꿈당",https://blog.naver.com/sadalsuud14/222981923706,
342,신림역 헬스장 드디어 내가 찾던곳이 생겼네요,https://blog.naver.com/cndmdlslpw/222949118663,
343,신림역투룸전세 풀옵션투룸... 전세대출가능 신림동투룸전... ,https://blog.naver.com/hinano00/222956622220,
344,"점심 메뉴 (신림역 근처, 서울 밥집)",https://blog.naver.com/syayaaa/222986143611,
345,신림역 킴쓰해물로스/해산물과 소고기 버터구이,https://blog.naver.com/28ssan/222825118578,
346,신림역족발 귀한족발 신림족발 보쌈 모두 맛볼 수 있는 구성!,https://blog.naver.com/hellogome/222809000312,
347,신림 분위기 좋은 술집 수지상회 신림역 핫플 이유 있어,https://blog.naver.com/chalk0801/222981754694,
348,"관악구 신림동 2룸, 투룸 빌라... 신대방역, 신림역 역세권... ",https://blog.naver.com/ablecrew_/222981151334,
349,신림역투룸월세 서원역초역세권위치 풀옵션 투룸월세 2000... ,https://blog.naver.com/hinano00/222967449922,
350,신대방역세권 신림역 모두 가까운 신림동신축빌라,https://blog.naver.com/wit_realtor/222838863179,
351,신림역 헬스장 어깨운동을 하는 두가지 방법,https://blog.naver.com/ddxqcn58/222542718633,
352,［신림동고기］인생고기 신림역점-생고기특수부위전문점 추천,https://blog.naver.com/sujan1370/222872813290,
353,카페스트릿1597 | 힙하면서 아늑한 신림역 신상카페 추천☕️,https://blog.naver.com/soru1103/222983061454,
354,신림 &lt;생생조개&gt; 신림역 조개구이 조개찜 원픽,https://blog.naver.com/luciain/222980849327,
355,신림동삼겹살 맛집 저온숙성 참숯화로구이 본화로 신림역 고깃집,https://blog.naver.com/wkddbsk308/222871922365,
356,아이랑 신림역 알라딘 중고서점 다녀옴,https://blog.naver.com/kong4114/222857924373,
357,"신림역닭발, 여기 닭발 먹고 다른 닭발집에서 닭발 못먹어요... ",https://blog.naver.com/woorilove88/222983603743,
358,신림역 별빛거리 24시 삼겹살도 맛있는 대원갈비,https://blog.naver.com/1000kggggg/222977591642,
359,센트레빌335 신림역 오피스텔 상가 청약정보,https://blog.naver.com/ji_eun_kr/222546903403,
360,[맛집] 신림역 국물닭발맛집 &apos;두리닭발앤쪽갈비&apos;,https://blog.naver.com/dmd7438/222983868421,
361,신림역 왕와플 《딸기크림&amp;사과쨈》,https://blog.naver.com/cho_yongwon/222960848477,
362,신림 술집 I 이색적인 신림데이트 원한다면 신림역 포차... ,https://blog.naver.com/sharontable/222883711717,
363,신림역 필라테스 초보자도 쉽게 운동할 수 이따!,https://blog.naver.com/kvidopkgac/222350470413,
364,맛집 신림역 오첨지 오삼불고기 강추!,https://blog.naver.com/goygoyvu/222847207307,
365,"신림선 노선도(feat. 신림역, 대방역, 보라매역 막차 시간)",https://blog.naver.com/buzabooboo/222986693636,
366,신림역왁싱은 프레쉬왁싱에서~,https://blog.naver.com/fresh_kim/222723251395,
367,"벨라스톤CC ( 야간라운딩 ) , 원주 용소막성당 &amp; 신림역 (폐역 )... ",https://blog.naver.com/danbii1004/222904765991,
368,신림역 헬스장 다양한 스쿼트를 배워봅시다,https://blog.naver.com/ddxqcn58/222473212352,
369,신림역 미용실 박준뷰티랩 신림 관악점 남자 커트 후기,https://blog.naver.com/likz03/222972872316,
370,신림역탈모치료 유형마다 다르기에,https://blog.naver.com/yonseigowoon/222845239934,
371,신림역 경락마사지 비만관리 제트슬림 신림동 다이어트,https://blog.naver.com/kimej7290/222974075397,
372,신림역 삼겹살 맛집 고기싸롱에서 고기뷔페 배터지게 먹었어요!,https://blog.naver.com/alice7743/222987348380,
373,신림역 정형외과 통증관리로 증상 회복을,https://blog.naver.com/qtwd19ozye/222980168174,
374,신림동 신림역 참치 혼마구로 코스로 즐기는 맛집 이종대... ,https://blog.naver.com/goindol71/222848595269,
375,신림역보쌈 가성비 좋은 흥부보쌈,https://blog.naver.com/happyhope26/222972956754,
376,신림역 안주가 맛있는 술집 수지상회 신림직영점,https://blog.naver.com/gnlyun/222980240916,
377,신림역 필라테스 일요일에도 자세교정하기!,https://blog.naver.com/kvidopkgac/222302596317,
378,신림역 맛집 순대타운 백순대 맛집 전주 3층 전주익산집,https://blog.naver.com/lsh1000j/222974534200,
379,신림역 삼겹살 맛집 냉삼존맛 삼삼당 신림 고기집,https://blog.naver.com/wkddbsk308/222792569282,
380,신림역 봉천역카페 도넛맛집 배배꼬,https://blog.naver.com/sjm172/222990482614,
381,[신림역 막국수]  막불감동 비빔막국수 건강한 메밀집,https://blog.naver.com/ssong6604/222865834806,
382,신림역 카페 모임하기 좋은 신림 디저트 카페 디저트문,https://blog.naver.com/lindseyh/222811851831,
383,[맛집] 신림닭발 신림역닭발 콩나물 팍팍 들어간 국물 닭발이... ,https://blog.naver.com/grapefruit--/222988507409,
384,신림역 술집 안주백화점 포차느낌 좋아요♡,https://blog.naver.com/lp090701/222967731629,
385,신림역 맛집 수제버거 포장 맛집 &lt;시티버거&gt;,https://blog.naver.com/noori_world/222973189188,
386,신림피부관리 여배우들이 하는 방법 신림역 피부샵 하얀스킨... ,https://blog.naver.com/day1116/222979804847,
387,"[관악/신림] 하이볼 맛집, 분위기 좋은 신림역 술집 ‘우리... ",https://blog.naver.com/eva9013/222868762253,
388,센트레빌335 신림역 오피스텔 동부센트레빌 청약 정보,https://blog.naver.com/isqueen76/222573685168,
389,신림역 참치 맛집 이종대 거해참치,https://blog.naver.com/500djrksm/222848595048,
390,"신림 포도몰맛집, 명동칼국수 샤브샤브신림역",https://blog.naver.com/whqhrud0919/222975797291,
391,신림역종합건강검진 : 삼모라인내과의원(feat. 대장내시경... ,https://blog.naver.com/buzabooboo/222990964925,
392,신림역 헬스 코어부터 차근차근 완성!,https://blog.naver.com/ddxqcn58/222445933293,
393,[신림역 필라테스/신림동 필라테스] 신림역 필라테스 추천... ,https://blog.naver.com/eoudy/222906676493,
394,신림역 참치는 퀄리티 좋은 최후의 참치가 진쯔 맛있다,https://blog.naver.com/cdolove/222800393134,
395,신림역 삼계탕 맛집 지리산삼계탕 _ 갈비탕도 예술,https://blog.naver.com/dldnfl5/222977162443,
396,신림역 오피스텔 2호선 초역세권 헤센 더스타 공급정보,https://blog.naver.com/lll0w0/222813106941,
397,신림역 / 돼지고기 구워주는 맛집 [왕주먹],https://blog.naver.com/tkdstudio/222988721477,
398,신림 포도몰 맛집 명동칼국수 샤브샤브 신림역점 샤브샤브... ,https://blog.naver.com/ziiye/222981798386,
399,신림역 맛집 테그42 에그토스트 브런치 데이트,https://blog.naver.com/qkqhtlzld95/222969022297,
400,"수제케이크 맛집, 신림역 카페 디저트문 모임장소로 굿!",https://blog.naver.com/wkddbsk308/222811624246,
401,[신림역 샐러드] 신선하고 건강한 신림 샐러드 전문점... ,https://blog.naver.com/ray_bros/222990945251,
402,신림역 핫플 논다노래타운에 다녀왔습니다 | 리얼 후기,https://blog.naver.com/expense5572/222985132091,
403,신림짬뽕 맛집 추천! 신림역중국집 무궁화 반점,https://blog.naver.com/wkddbsk308/222809662950,
404,스웨디시세아 이전공지 ❤ 신림역에서 만나효(2월~),https://blog.naver.com/skarud333345/222986992128,
405,[신림 헬스장] 트렌디한 헬스장 파운드짐 신림역점,https://blog.naver.com/opopoioi/222974698095,
406,"[신림] 분위기 좋은 신림역 술집 추천 금별맥주, 새벽 6시까지... ",https://blog.naver.com/hizahi/222988180034,
407,신림역 삼겹살 맛집: 고앤고,https://blog.naver.com/oldlove1232/222978451132,
408,"신림역이용넓은원룸, 베란다있고 환한 가성비좋은원룸 500/40",https://blog.naver.com/city3ssuk/222795150773,
409,신림역피부과 피부 더이상 방치하지마세요,https://blog.naver.com/pvnan330k/222961764262,
410,신림역 헤센더스타 오피스텔 분양 정보 알아볼 때,https://blog.naver.com/bodykong/222753153733,
411,[신림역 케이크] 우유 생크림이 듬뿍 발라진 코코케이크,https://blog.naver.com/airumeraru/222798772219,
412,"신림역싼원룸 넓은방,풀옵션 2000/20",https://blog.naver.com/city3ssuk/222695393925,
413,"신림역 헤센더스타 오피스텔,상가 분양정보",https://blog.naver.com/yeajun89/222731495801,
414,신림역 헤센 더스타 오피스텔 분양정보,https://blog.naver.com/again_98/222773052327,
415,[신림사거리] 펀비어킹 관악 신림역점,https://blog.naver.com/swiss9769/222860191744,
416,신림족발 신림역 근처 야들야들 귀한족발,https://blog.naver.com/uchihehe/222803047347,
417,혹평없던 신림역 술집,https://blog.naver.com/soojini65/222719324643,
418,신림역 술집 &lt;요리하는 술집&gt; 분위기 좋고 맛 좋은 동네 술집,https://blog.naver.com/noori_world/222936944521,
419,술이 쭉쭉! 신림 술집 신림역 닭발 맛집. 불타는꼬꼬발 신림본점,https://blog.naver.com/mchwan/222840122713,
420,[서울/신림] &apos;흥부보쌈&apos; 30년 전통 신림역 보쌈 맛집,https://blog.naver.com/jwle194/222972050937,
421,"&lt;신림역주변사무실&gt; 칸막이3개설치,룸1설치,2층36평,3000/180",https://blog.naver.com/city3ssuk/222831451141,
422,신림역 맛집 신림춘천집 치즈폭포닭갈비가 맛있는 곳,https://blog.naver.com/kyd5209/222940780854,
423,신림삼겹살맛집 국내산 한돈 참숯구이 전문 &apos;인생고기&apos; 신림역점,https://blog.naver.com/love__lover/222991550148,
424,신림역카페 신림분위기좋은카페 찾으신다면 카페 in 하루 추천,https://blog.naver.com/wleoddl5774/222970664766,
425,신림역 역세권 청년주택 ‘최강타워’ 입주자 모집 안내,https://blog.naver.com/gwanak_gu/222973429483,
426,신림역 헬스장 뱃살제거는 오늘부터 하기,https://blog.naver.com/ddxqcn58/222367721911,
427,신림역치과 다양한 부분을 고려해서 진행하는,https://blog.naver.com/plain10205/222956303478,
428,신림역 순대타운 맛집_ 전주익산집  백순대 추천,https://blog.naver.com/hankangbubu/222977550676,
429,신림역 맛집 삼삼당 냉삼에 백김치 고사리 조합 완벽,https://blog.naver.com/kagama007/222742791333,
430,"신림 카페, 디저트가 다양한 신림역 카페 디저트문",https://blog.naver.com/kkamyi/222771461769,
431,더블역세권 신림역에서 가까운 가성비 투룸,https://blog.naver.com/soato42/222744473762,
432,신림역 실내포차 : 달맞이이모네,https://blog.naver.com/bsb7411/222687894263,
433,신림역다이어트한의원 타하라디톡스,https://blog.naver.com/jjhyug1/222771179097,
434,신림역’ 힙한 예쁜카페 [폼앤노말]☕️,https://blog.naver.com/snwhmz/222821308519,
435,신림역디저트 배달의민족 와플맛집 놀러와플 자꾸 생각나~,https://blog.naver.com/arsoap/222811491369,
436,신림역치과 체계적인 관리 받으려면,https://blog.naver.com/phant0mgirl/222906835275,
437,신림동 맛집 신림역 소문난 냉삼 맛집 삼삼당,https://blog.naver.com/hwaja75/222749317517,
438,신림역 헤센더스타 오피스텔 분양 전매가능,https://blog.naver.com/honeyjoun/222723969247,
439,신림역 맛집 수제만두 생각날땐 전설의왕만두 신림점,https://blog.naver.com/lessismoremin/222967068488,
440,신림역원룸 406m 보증금100 월세 34 부동산 집찾기,https://blog.naver.com/i_mcheon/222728670636,
441,신림역족발 귀한족발 부드럽고 쫀득쫀득,https://blog.naver.com/jjubu0691/222725933296,
442,［신림역커리］신림커리 청춘커리-영국식인도커리  추천... ,https://blog.naver.com/sujan1370/222844254913,
443,[서울맛집][당곡역/신림역]한마음정육식당 신림점 육즙가득한... ,https://blog.naver.com/kimeh2497/222989603422,
444,신림역 최애 냉삼겹살 맛집 33삼삼당,https://blog.naver.com/ssda1001/222989432322,
445,[맛집] 조용한 분위기의 신림역 술집 &apos;요리하는술집&apos;,https://blog.naver.com/dmd7438/222983800293,
446,[신림역] 수준급의 라멘집 신바야시 쇼쿠도,https://blog.naver.com/khunjax/222825609450,
447,&lt;2호선&gt; 신림역 피자맛집 신림본점 피자탑 가성비 좋은 피자,https://blog.naver.com/qkfntm1234/222987604612,
